artists,duration_ms,explicit,id,key,modified_query,name,num_weeks,popularity,release_date,search_query,uri
,255560.0,True,,"2 Chainz, Travis Scott",,4 AM,12,,2017-06-16,2 chainz 4 am,spotify:track:1nX9KhK3Fff27SnrIor2Yb
,210200.0,True,,"2 Chainz, Ty Dolla $ign, Trey Songz, Jhene Aiko",,It's A Vibe,20,,2017-06-16,2 chainz it's a vibe,spotify:track:6H0AwSQ20mo62jGlPGB8S6
,234666.0,True,,"2 Chainz, YG, Offset",,PROUD,2,,2018-02-08,2 chainz proud,spotify:track:365wwIjijQdlRJEjUWTidq
,225893.0,True,,"2 Chainz, Drake, Quavo",,Bigger Than You (feat. Drake & Quavo),2,,2018-06-15,"2 chainz, drake bigger > you",spotify:track:5S1IUPueD0xE0vj4zU3nSf
,220306.0,True,,21 Savage,,Bank Account,28,,2017-09-23,21 savage bank account,spotify:track:2fQrGHiQOvpL9UgPvtYy6G
,234280.0,True,,21 Savage,,Famous,1,,2017-09-23,21 savage famous,spotify:track:6g0TAJ1grweRwBMLQyiZFb
,235040.0,True,,"21 Savage, Metro Boomin",,No Heart,5,,2016-07-15,21 savage no heart,spotify:track:4gmmRb6bZJffOOiww1JGTO
,258880.0,True,,"21 Savage, Metro Boomin, Future",,X (feat. Future),1,,2016-07-15,21 savage x,spotify:track:6fwdbPMwP1zVStm8FybmkO
,268933.0,True,,"21 Savage, Offset, Metro Boomin, Travis Scott",,Ghostface Killers,7,,2017-10-30,"21 savage, offset ghostface killers",spotify:track:5u6vkDnOyaf8LsteDAj2ub
,202666.0,True,,"21 Savage, Offset, Metro Boomin",,Mad Stalkers,1,,2017-10-30,"21 savage, offset mad stalkers",spotify:track:6HR1z11h0ROUlWP4Kx8Z7G
,257600.0,True,,"21 Savage, Offset, Metro Boomin, Quavo",,Rap Saved Me,3,,2017-10-30,"21 savage, offset rap saved me",spotify:track:0tdCy39PgWN8LFWu34ORn3
,173081.0,True,,5 Seconds of Summer,,Want You Back,1,,2018-06-15,5 seconds of summer want you back,spotify:track:2vHfabj6nFebekTYODqntl
,203417.0,False,,5 Seconds of Summer,,Youngblood,5,,2018-06-15,5 seconds of summer youngblood,spotify:track:2iUXsYOEPhVqEBwsqP70rE
,246773.0,True,,6LACK,,PRBLMS,8,,2016-11-18,6lack prblms,spotify:track:4AtZRwSR8BOTTQg5ihSggt
,112666.0,True,,6ix9ine,,BILLY,8,,2018-04-10,6ix9ine billy,spotify:track:5KhFaq45chTw8RGfWo8T8J
,166851.0,True,,6ix9ine,,GOTTI,1,,2018-04-10,6ix9ine gotti,spotify:track:27oFpFktCq9JIXjJQRuv7a
,157643.0,True,,6ix9ine,,GUMMO,19,,2018-04-10,6ix9ine gummo,spotify:track:4HbiCvH1R7mVOJ7KY7JQBD
,142582.0,True,,6ix9ine,,KOODA,8,,2018-04-10,6ix9ine kooda,spotify:track:0tYHqwTW4s6VuPWDSD7n7K
,138473.0,True,,"6ix9ine, Tory Lanez, Young Thug",,RONDO,1,,2018-04-10,6ix9ine rondo,spotify:track:3p6JF5nt0bZOSgZRONNZp0
,154565.0,True,,"6ix9ine, DJ SpinKing",,TATI (feat. DJ SpinKing),5,,2018-11-27,6ix9ine tati,spotify:track:6wJrqTE6c4NtfDqAcSRcBf
,151914.0,True,,"6ix9ine, Fetty Wap, A Boogie Wit da Hoodie",,KEKE,8,,2018-04-10,"6ix9ine, fetty wap keke",spotify:track:14PlDNjNh3pXyHXzkhX8n5
,258158.0,True,,"A Boogie Wit da Hoodie, PnB Rock, YoungBoy Never Broke Again",,Beast Mode (feat. PnB Rock & YoungBoy Never Broke Again),1,,2017-09-29,a boogie wit da hoodie beast mode,spotify:track:1AH60dMaEfNjzDoUIFwIQi
,209269.0,True,,"A Boogie Wit da Hoodie, Kodak Black",,Drowning (feat. Kodak Black),21,,2017-09-29,a boogie wit da hoodie drowning,spotify:track:1f5cbQtDrykjarZVrShaDI
,197666.0,True,,A Boogie Wit da Hoodie,,No Promises,2,,2017-09-29,a boogie wit da hoodie no promises,spotify:track:2BJpuAoDeQ1QuPvnryfAWK
,214853.0,True,,A Boogie Wit da Hoodie,,Say A',2,,2017-09-29,a boogie wit da hoodie say a',spotify:track:3AMnOVxEHUgVrythGgqPhI
,174012.0,True,,"A Boogie Wit da Hoodie, 21 Savage",,Undefeated (feat. 21 Savage),1,,2017-09-29,a boogie wit da hoodie undefeated,spotify:track:2vaMWMPMgsWX4fwJiKmdWm
,173600.0,True,,A$AP Ferg,,Plain Jane,24,,2017-08-18,a$ap ferg plain jane,spotify:track:4dVpf9jZjcORqGTLUaeYj9
,233061.0,True,,"A$AP Rocky, Moby",,A$AP Forever,2,,2018-04-05,a$ap rocky a$ap forever,spotify:track:1YmF9PvLhIISIANoMLIYGq
,205040.0,True,,"A$AP Rocky, Skepta",,Praise The Lord (Da Shine) (feat. Skepta),5,,2018-05-25,a$ap rocky praise the lord (da shine),spotify:track:7ycWLEP1GsNjVvcjawXz3z
,202193.0,False,,AJR,,Weak,11,,2016-09-16,ajr weak,spotify:track:45iMRHmfLZu3yjdZ8P5e3t
,210985.0,False,,Addison Agen,,Tennessee Rain - The Voice Performance,1,,2017-12-20,addison agen tennessee rain,spotify:track:54p39OJ544KF6iFeCzbVjs
,240426.0,False,,Adele,,Water Under the Bridge,10,,2016-06-24,adele water under the bridge,spotify:track:4vb4mFvYsr2h6enhjJsq9Y
,227693.0,False,,Alessia Cara,,Out Of Love,1,,2018-11-30,alessia cara growing pains,spotify:track:4WzhjxvLP95y7AMDy0Atwb
,175506.0,False,,Alessia Cara,,How Far I'll Go - Alessia Cara Version,11,,2016-11-18,alessia cara how far i'll go,spotify:track:1ehPJRt49h6N0LoryqKZXq
,230226.0,False,,Alessia Cara,,Scars To Your Beautiful,21,,2015-11-13,alessia cara scars to your beautiful,spotify:track:0prNGof3XqfTvNDxHonvdK
,235813.0,False,,Alice Merton,,No Roots,3,,2017-08-04,alice merton no roots,spotify:track:4CdfFYzaAJ0y0beKzmgJSn
,209640.0,True,,Aminé,,Caroline,7,,2017-07-28,amine caroline,spotify:track:5hTpBe8h35rJ67eAWHQsJx
,198001.0,False,,Andy Grammer,,Fresh Eyes,1,,2017-12-01,andy grammer fresh eyes,spotify:track:5NDUXbMwcnTQp66tI2zcdR
,151933.0,False,,Andy Williams,,It's the Most Wonderful Time of the Year,3,,1963,andy williams it's the most wonderful time of the year,spotify:track:5hslUAKq9I9CG2bAulFkHN
,227933.0,False,,"Ariana Grande, John Legend",,Beauty and the Beast,1,,2017-03-10,ariana grande beauty and the beast,spotify:track:5mRNFh0zp9qY1kDpecN9ot
,194840.0,True,,"Ariana Grande, Future",,Everyday,7,,2016-05-20,ariana grande everyday,spotify:track:6yL2kTsdVwYnGwPkKGtMd5
,205920.0,False,,Ariana Grande,,no tears left to cry,11,,2018-08-17,ariana grande no tears left to cry,spotify:track:2qT1uLXPVPzGgFOx4jtEuo
,226160.0,True,,"Ariana Grande, Nicki Minaj",,Side To Side,6,,2016-05-20,ariana grande side to side,spotify:track:1pKeFVVUOPjFsOABub0OaV
,228373.0,True,,"Ariana Grande, Nicki Minaj",,the light is coming (feat. Nicki Minaj),1,,2018-08-17,ariana grande the light is coming,spotify:track:0sdbFOyfgAhAhWq8DpzkaW
,163386.0,False,,Auli'i Cravalho,,How Far I'll Go,11,,2016-11-18,auli'i cravalho how far i'll go,spotify:track:6mb6lVLNrcUgLnEN8QnDJd
,247426.0,False,,Avicii,,Wake Me Up,1,,2013-01-01,avicii wake me up!,spotify:track:4h8VwCb1MTGoLKueQ1WgbD
,238586.0,False,,Ayo & Teo,,Rolex,25,,2017-03-15,ayo rolex,spotify:track:0pSBuHjILhNEo55xK1zrRt
,209355.0,False,,BLACKPINK,,DDU-DU DDU-DU,1,,2018-06-15,blackpink ddu-du ddu-du,spotify:track:2aI2k39nfa3KFsa4JclQzw
,223122.0,False,,BTS,,DNA,4,,2017-09-18,bts dna,spotify:track:5SE57ljOIUJ1ybL9U6CuBH
,242333.0,False,,BTS,,FAKE LOVE,6,,2018-05-18,bts fake love,spotify:track:3aW0ds4A4tSQDIp75FqWTo
,307675.0,False,,"BTS, Steve Aoki",,MIC Drop (Steve Aoki Remix) [Full Length Edition],9,,2018-08-24,bts mic drop,spotify:track:75scDPqGs75FotglJSoOI2
,215724.0,False,,Backstreet Boys,,Don't Go Breaking My Heart,2,,2018-05-17,backstreet boys don't go breaking my heart,spotify:track:79Mjfhh393dZdAsTvUFDR6
,254805.0,False,,Bad Wolves,,Zombie,17,,2018-01-19,bad wolves zombie,spotify:track:1vNoA9F5ASnlBISFekDmg3
,131064.0,True,,Bazzi,,Mine,24,,2018-04-12,bazzi mine,spotify:track:7uzmGiiJyRfuViKKK3lVmR
,191786.0,False,,Bebe Rexha,,I Got You,7,,2018-06-22,bebe rexha i got you,spotify:track:2jB9QaPJyVdz2Q0Va8rrnU
,163870.0,False,,"Bebe Rexha, Florida Georgia Line",,Meant to Be (feat. Florida Georgia Line),36,,2017-08-11,bebe rexha meant to be,spotify:track:7iDa6hUg2VgEL1o1HjmfBn
,202453.0,False,,"Becky G, Bad Bunny",,Mayores,17,,2017-07-14,becky g mayores,spotify:track:7JNh1cfm0eXjqFVOzKLyau
,151850.0,True,,"Bhad Bhabie, Lil Yachty",,Gucci Flip Flops (feat. Lil Yachty),3,,2018-09-18,bhad bhabie gucci flip flops,spotify:track:3hv6ndi7uFT9L9wrhQCsqY
,104528.0,True,,Bhad Bhabie,,Hi Bich,1,,2017-09-21,bhad bhabie hi bich,spotify:track:5JW8njiQorZ7m2VHYddTt6
,140007.0,True,,Bhad Bhabie,,These Heaux,3,,2017-08-24,bhad bhabie these heaux,spotify:track:6SUxrwVN19Kmd9JfIbjJUj
,222360.0,True,,Big Sean,,Bounce Back,16,,2017-02-03,big sean bounce back,spotify:track:0SGkqnVQo9KPytSri1H6cF
,268946.0,True,,"Big Sean, Metro Boomin, Travis Scott",,Go Legend (& Metro Boomin),1,,2017-12-08,big sean go legend,spotify:track:3wAI7MIQtTgwcRmwchPZBc
,230960.0,True,,Big Sean,,Halfway Off The Balcony,1,,2017-02-03,big sean halfway off the balcony,spotify:track:4atJ40xfasjdM9ZF3p07BV
,213693.0,True,,Big Sean,,Jump Out The Window,1,,2017-02-03,big sean jump out the window,spotify:track:1jQsKN68yE94tMYml0wHMd
,210506.0,True,,"Big Sean, Jeremih",,Light,1,,2017-02-03,big sean light,spotify:track:0URaKGzNTtzKRtsJN1RkA9
,142906.0,True,,Big Sean,,Moves,14,,2017-02-03,big sean moves,spotify:track:0Fv5N0cHBsl4bzCbollCAS
,325840.0,True,,"Big Sean, Eminem",,No Favors,3,,2017-02-03,big sean no favors,spotify:track:1MksGqIztTT6M9R1ErKVs8
,271693.0,True,,Big Sean,,Owe Me,1,,2017-02-03,big sean owe me,spotify:track:1u0MOgWF1bbylVxpJG2ZjB
,227533.0,True,,"Big Sean, Metro Boomin, 21 Savage",,Pull Up N Wreck (& Metro Boomin),2,,2017-12-08,big sean pull up n wreck,spotify:track:7DuvVy7JfFgXwWlVzyyPys
,287320.0,True,,"Big Sean, Migos",,Sacrifices,1,,2017-02-03,big sean sacrifices,spotify:track:1r0faljjM2b876iNoaDUh5
,200185.0,False,,"Billie Eilish, Khalid",,lovely (with Khalid),5,,2018-04-19,billie eilish lovely,spotify:track:0u2P5u6lvoDfwTYjAADbn4
,234306.0,False,,Billy Currington,,Do I Make You Wanna,19,,2015-06-02,billy currington do i make you wanna,spotify:track:3I7krC8kr0gFR7P6vInR1I
,160037.0,True,,Blac Youngsta,,Booty,5,,2018-02-27,blac youngsta booty,spotify:track:0FbSpY8RPxTRxi1Fpj9Dz9
,212027.0,True,,blackbear,,do re mi,25,,2017-04-21,blackbear do re mi,spotify:track:3Q3myFA7q4Op95DOpHplaY
,189466.0,False,,Blake Shelton,,A Guy With a Girl,6,,2016-05-20,blake shelton a guy with a girl,spotify:track:5sjIhQzNljMVrDklI91ezp
,214800.0,False,,Blake Shelton,,Every Time I Hear That Song,11,,2016-05-20,blake shelton every time i hear that song,spotify:track:0c4ICGb0jvszKj3KPR59JU
,219600.0,False,,Blake Shelton,,I Lived It,18,,2017-11-03,blake shelton i lived it,spotify:track:5slddJ629YcePvqD6Uyk8r
,183640.0,False,,Blake Shelton,,I'll Name the Dogs,19,,2017-11-03,blake shelton i'll name the dogs,spotify:track:609qKv3KPAbdtp0LQH2buA
,181263.0,True,,"BlocBoy JB, Drake",,Look Alive (feat. Drake),21,,2018-02-09,blocboy jb look alive,spotify:track:4qKcDkK6siZ7Jp1Jb4m0aL
,131733.0,False,,Bobby Helms,,Jingle Bell Rock,1,,1998-01-01,bobby helms jingle bell rock,spotify:track:6xE98wKYt4vZk8j7cctjw8
,229338.0,False,,Brad Paisley,,Today,7,,2017-04-21,brad paisley today,spotify:track:1IO13V09b01gLSbmZJZ9dM
,187760.0,False,,Brantley Gilbert,,The Weekend,16,,2017-01-27,brantley gilbert the weekend,spotify:track:48tAdjG4ng2JfECa7OQujk
,126266.0,False,,Brenda Lee,,Rockin' Around The Christmas Tree,3,,1964-10-19,brenda lee rockin' around the christmas tree,spotify:track:2EjXfH91m7f8HiJN1yQg97
,208720.0,False,,Brett Eldredge,,The Long Way,12,,2017-08-04,brett eldredge the long way,spotify:track:5vuMtXS5kQ7F0o9V9rG1dG
,224853.0,False,,Brett Young,,In Case You Didn't Know,28,,2017-02-10,brett young in case you didn't know,spotify:track:10M2Ex445zw585Ducldzkw
,207186.0,False,,Brett Young,,Like I Loved You,19,,2017-02-10,brett young like i loved you,spotify:track:3T6MAweakkNrMYs8jZIWtg
,217120.0,False,,Brett Young,,Mercy,9,,2017-02-10,brett young mercy,spotify:track:2VIPU72L6tIR4w8J8ap6Kp
,216800.0,False,,Brothers Osborne,,It Ain't My Fault,16,,2016-01-15,brothers osborne it ain't my fault,spotify:track:08wJ1B9yu9sPeoRa5fbpr3
,206693.0,False,,Bruno Mars,,That's What I Like,25,,2016-11-17,bruno mars 24k magic,spotify:track:0KKkJNfGyhkQ5aFogxQAPU
,217288.0,False,,"Bruno Mars, Cardi B",,Finesse - Remix; feat. Cardi B,23,,2017-12-20,bruno mars finesse,spotify:track:3Vo4wInECJQuz9BIBMOu8i
,206693.0,False,,Bruno Mars,,That's What I Like,49,,2016-11-17,bruno mars that's what i like,spotify:track:0KKkJNfGyhkQ5aFogxQAPU
,261240.0,False,,Bruno Mars,,Versace on the Floor,12,,2016-11-17,bruno mars versace on the floor,spotify:track:0kN8xEmgMW9mh7UmDYHlJP
,209040.0,True,,Bryson Tiller,,Don't Get Too High,1,,2017-05-26,bryson tiller don't get too high,spotify:track:0OVhQZkNe7lh0fQeH96EFW
,134746.0,True,,Bryson Tiller,,No Longer Friends,1,,2017-05-26,bryson tiller no longer friends,spotify:track:4IdAIZRVkwuQQnHpi529cn
,169266.0,True,,Bryson Tiller,,Run Me Dry,1,,2017-05-26,bryson tiller run me dry,spotify:track:5GG3knKdxKWrNboRijxeKF
,167853.0,True,,Bryson Tiller,,Self-Made,1,,2017-05-26,bryson tiller self-made,spotify:track:2rUwQj4SWaP2anuGDtNpYR
,194266.0,True,,Bryson Tiller,,Somethin Tells Me,1,,2017-05-26,bryson tiller somethin tells me,spotify:track:3Jrs7cC2OJNlNSy9VnDOMZ
,135533.0,False,,Burl Ives,,A Holly Jolly Christmas - Single Version,3,,1965-01-01,burl ives a holly jolly christmas,spotify:track:65Q2mv3UlVi9eO70OpsmSe
,260285.0,False,,Calum Scott,,Dancing On My Own,1,,2018-03-09,calum scott dancing on my own,spotify:track:2BOqDYLOJBiMOXShCV1neZ
,240093.0,True,,"Calvin Harris, Kehlani, Lil Yachty",,Faking It (feat. Kehlani & Lil Yachty),4,,2017-06-30,calvin harris faking it,spotify:track:0pJPdSVti6cTM1Q6xYGmcf
,223413.0,True,,"Calvin Harris, Pharrell Williams, Katy Perry, Big Sean",,"Feels (feat. Pharrell Williams, Katy Perry & Big Sean)",18,,2017-06-30,calvin harris feels,spotify:track:5bcTCxgc7xVfSaMV3RuVke
,229160.0,True,,"Calvin Harris, Young Thug, Pharrell Williams, Ariana Grande",,"Heatstroke (feat. Young Thug, Pharrell Williams & Ariana Grande)",1,,2017-06-30,calvin harris heatstroke,spotify:track:60APt5N2NRaKWf5xzJdzyC
,214846.0,False,,"Calvin Harris, Dua Lipa",,One Kiss (with Dua Lipa),13,,2018-04-06,calvin harris one kiss,spotify:track:7ef4DlsgrMEH11cDZd32M6
,272666.0,True,,"Calvin Harris, Future, Khalid",,Rollin,4,,2017-05-12,calvin harris rollin,spotify:track:3FDrI0FLKzrYQiWxPhqV2W
,230813.0,True,,"Calvin Harris, Frank Ocean, Migos",,Slide (feat. Frank Ocean & Migos),20,,2017-02-24,calvin harris slide,spotify:track:6gpcs5eMhJwax4mIfKDYQk
,216391.0,False,,Camila Cabello,,Crying in the Club,9,,2017-05-18,camila cabello crying in the club,spotify:track:1SJtlNRJDeYHioymcvsqev
,217306.0,False,,"Camila Cabello, Young Thug",,Havana (feat. Young Thug),45,,2018-01-12,camila cabello havana,spotify:track:1rfofaqEpACxVEHIZBJe6W
,226973.0,False,,Camila Cabello,,Never Be the Same,29,,2018-01-12,camila cabello never be the same,spotify:track:4eWQlBRaTjPPUlzacqEeoQ
,228893.0,False,,"Camila Cabello, Quavo",,OMG,1,,2017-08-03,camila cabello omg,spotify:track:4xBjsLUSjcx2h7PcRikpQp
,224284.0,True,,"Cardi B, 21 Savage",,Bartier Cardi (feat. 21 Savage),19,,2018-04-06,cardi b bartier cardi,spotify:track:0dIoGTQXDh1wVnhIiSyYEa
,210787.0,True,,Cardi B,,Be Careful,14,,2018-04-06,cardi b be careful,spotify:track:2Yl4OmDby9iitgNWZPwxkd
,284855.0,True,,"Cardi B, Chance the Rapper",,Best Life (feat. Chance The Rapper),3,,2018-04-06,cardi b best life,spotify:track:00B7TZ0Xawar6NZ00JFomN
,181623.0,True,,Cardi B,,Bickenhead,2,,2018-04-06,cardi b bickenhead,spotify:track:17Yq72h0p15OhCbZ5lJ5gd
,220395.0,False,,2017 Dynamo Hitz,,Bodak Yellow (Money Moves),34,,2017-09-13,cardi b bodak yellow (money moves),spotify:track:3g2qgbWPl8TcgJIkstWpSV
,262308.0,True,,"Cardi B, Migos",,Drip (feat. Migos),10,,2018-04-06,cardi b drip,spotify:track:2qcG0nZ6S3zZV0UrkY5nFo
,231453.0,True,,Cardi B,,Get Up 10,2,,2018-04-06,cardi b get up 10,spotify:track:7p2ewixAShLpjDZrnzZK7c
,200205.0,True,,"Cardi B, SZA",,I Do (feat. SZA),5,,2018-04-06,cardi b i do,spotify:track:1f5PNhkNgUpvDEeZfcIlO1
,229004.0,True,,Cardi B,,Money Bag,2,,2018-04-06,cardi b money bag,spotify:track:1vBeIXlzbAieGoDqInav5j
,177139.0,True,,"Cardi B, Kehlani",,Ring (feat. Kehlani),4,,2018-04-06,cardi b ring,spotify:track:5DfWF0jqMgZDCiu9zJENTA
,230952.0,True,,"Cardi B, YG",,She Bad,2,,2018-04-06,cardi b she bad,spotify:track:0CfmNX2TXk7yoJqHJiixnp
,188523.0,True,,Cardi B,,Thru Your Phone,3,,2018-04-06,cardi b thru your phone,spotify:track:74cVJfmK18rhWnscIpGXjt
,253390.0,True,,"Cardi B, Bad Bunny, J Balvin",,I Like It,13,,2018-04-06,"cardi b, bad bunny i like it",spotify:track:58q2HKrzhC3ozto2nDdN4z
,197826.0,False,,Carly Pearce,,If My Name Was Whiskey,17,,2017-10-13,carly pearce every little thing,spotify:track:2EXCLMhZF0XqmdCsSMYwt3
,246466.0,False,,Carrie Underwood,,Cry Pretty,4,,2018-04-11,carrie underwood cry pretty,spotify:track:47gqRMoIkFm7Rac86xZVh7
,204093.0,False,,Carrie Underwood,,Dirty Laundry,1,,2015-10-23,carrie underwood dirty laundry,spotify:track:5qRRiqndqXaq2QBudIrkYU
,223998.0,False,,"Carrie Underwood, Ludacris",,The Champion,3,,2018-01-12,carrie underwood the champion,spotify:track:0stPNUkU1LZnvxIcfrKnEZ
,417920.0,True,,"Nio Garcia, Casper Magico, Bad Bunny, Darell, Ozuna, Nicky Jam",,Te Boté - Remix,11,,2018-04-13,"casper magico, nio garcia, darell, nicky jam, ozuna te bote",spotify:track:3V8UKqhEK5zBkBb6d6ub8i
,208786.0,False,,Charlie Puth,,Attention,39,,2018-05-11,charlie puth attention,spotify:track:5cF0dROlMOK5uNZtivgu50
,180493.0,False,,"Charlie Puth, Kehlani",,Done for Me (feat. Kehlani),9,,2018-05-11,charlie puth done for me,spotify:track:1lsBTdE6MGsKeZCD6llNu7
,200853.0,False,,Charlie Puth,,How Long,23,,2018-05-11,charlie puth how long,spotify:track:6wmAHw1szh5RCKSRjiXhPe
,222786.0,False,,"Cheat Codes, Demi Lovato",,No Promises (feat. Demi Lovato),23,,2017-03-31,cheat codes no promises,spotify:track:5lNuqFVMca4vPupY10cH0J
,326933.0,True,,Childish Gambino,,Redbone,35,,2016-12-02,childish gambino redbone,spotify:track:0wXuerDYiBnERgIpbb3JBR
,225773.0,True,,Childish Gambino,,This Is America,9,,2018-05-06,childish gambino this is america,spotify:track:0b9oOr2ZgvyQu88wzixux9
,190720.0,False,,"China Anne McClain, Thomas Doherty, Dylan Playfair",,What's My Name,3,,2017-07-21,"china anne mcclain, thomas doherty what's my name",spotify:track:53xAT6jud1w0NqlBjSW4VB
,181794.0,False,,Chloe Kohanski,,Total Eclipse Of The Heart - The Voice Performance,1,,2017-12-20,chloe kohanski total eclipse of the heart,spotify:track:1pFkLWesh2zpoFTs2g4SFt
,220630.0,False,,Chloe Kohanski,,Wish I Didn’t Love You - The Voice Performance,1,,2017-12-20,chloe kohanski wish i didn't love you,spotify:track:0SqmAwQrNyypiTroSwVjbX
,194663.0,False,,Chris Blue,,Money On You - The Voice Performance,1,,2017-05-24,chris blue money on you,spotify:track:35ap6ekPdkGkiUkWfWhZB4
,202213.0,True,,"Chris Brown, Future, Young Thug",,High End,2,,2017-10-13,chris brown high end,spotify:track:2XdgSB4TtzUHQYCMfSHbFI
,220813.0,True,,"Chris Brown, Usher, Gucci Mane",,Party,14,,2016-12-16,chris brown party,spotify:track:05Z7jet4VDNVgNQWcYHnrk
,292910.0,True,,"Chris Brown, Yo Gotti, A Boogie Wit da Hoodie, Kodak Black",,Pills & Automobiles,19,,2017-08-04,chris brown pills and automobiles,spotify:track:4YkwUfWSIxdKNLDXw0caFO
,220963.0,True,,Chris Brown,,Privacy,17,,2017-03-24,chris brown privacy,spotify:track:2Vf2Pflg5rTWSvSCK4qq4A
,129477.0,False,,Chris Brown,,Questions,13,,2017-08-18,chris brown questions,spotify:track:5XQMr19TL7Mfksq9zihbOu
,218744.0,True,,Chris Brown,,Tempo,4,,2017-10-31,chris brown tempo,spotify:track:0709StHzSeXpdj2zmqF2o2
,188933.0,False,,Chris Janson,,Fix a Drink,14,,2017-09-22,chris janson fix a drink,spotify:track:0s6OWiWGuiCcm1Muzch5A8
,211226.0,False,,Chris Lane,,For Her,4,,2016-07-12,chris lane for her,spotify:track:19yTqpHTUrw7mOcRDvXYzn
,212080.0,False,,"Chris Lane, Tori Kelly",,Take Back Home Girl (feat. Tori Kelly),5,,2018-07-13,chris lane take back home girl,spotify:track:0N9uZRrJQ3lO5TmInEjLxc
,180906.0,False,,Chris Stapleton,,Broken Halos,20,,2017-05-05,chris stapleton broken halos,spotify:track:06gD2ZtK3Dzc1BYqWExQJJ
,248053.0,False,,Chris Stapleton,,Either Way,2,,2017-05-05,chris stapleton either way,spotify:track:6Wo5YxkdXgwzKQZbDg2r17
,178253.0,False,,Chris Young,,Losing Sleep,19,,2017-10-20,chris young losing sleep,spotify:track:6waqLPcT6ruMhmd36OhmFO
,194560.0,False,,"Chris Young, Vince Gill",,Sober Saturday Night (feat. Vince Gill),7,,2015-11-13,chris young sober saturday night,spotify:track:081t95JRuDUrQYSS3h8iKk
,205986.0,False,,"Clean Bandit, Julia Michaels",,I Miss You (feat. Julia Michaels),1,,2018-11-30,clean bandit i miss you,spotify:track:0Ult84lvFuqNvbyXwyRQ58
,251088.0,False,,"Clean Bandit, Sean Paul, Anne-Marie",,Rockabye (feat. Sean Paul & Anne-Marie),19,,2016-10-21,clean bandit rockabye,spotify:track:5knuzwU65gJK7IF5yJsuaW
,222653.0,False,,"Clean Bandit, Demi Lovato",,Solo (feat. Demi Lovato),1,,2018-05-17,clean bandit solo,spotify:track:6kPJZM97LwdG9QIsT7khp6
,199693.0,False,,Cole Swindell,,Break up in the End,1,,2018-08-17,cole swindell break up in the end,spotify:track:5Z19ylxppfnfdP4JH0u8oj
,177066.0,False,,"Cole Swindell, Dierks Bentley",,Flatliner (feat. Dierks Bentley),18,,2016-05-06,cole swindell flatliner,spotify:track:0WyFpxYlBCgH1gMXd26OOr
,226157.0,False,,Karaoke Instrumental Masters Collection,,Broccoli (Originally Performed by D.R.A.M.) - Instrumental Karaoke Version,4,,2017-10-06,d.r.a.m. broccoli,spotify:track:4JrTU7Hw1y9dkzcmGiQ69G
,229146.0,True,,"DJ Khaled, Calvin Harris, Travis Scott, Jeremih",,Don't Quit (feat. Travis Scott & Jeremih),1,,2017-06-22,dj khaled don't quit,spotify:track:6LOCAhFzZiavHcLJucLuDy
,288876.0,True,,"DJ Khaled, Justin Bieber, Quavo, Chance the Rapper, Lil Wayne",,"I'm the One (feat. Justin Bieber, Quavo, Chance the Rapper & Lil Wayne)",22,,2017-06-22,dj khaled i'm the one,spotify:track:1jYiIOC5d6soxkJP81fxq2
,233293.0,True,,"DJ Khaled, Travis Scott, Rick Ross, Big Sean",,"On Everything (feat. Travis Scott, Rick Ross & Big Sean)",1,,2017-06-22,dj khaled on everything,spotify:track:7lxZbmtC6SkUc2yXBgDOdO
,284000.0,True,,"DJ Khaled, Beyoncé, JAY Z",,Shining (feat. Beyoncé & Jay-Z),14,,2017-06-22,dj khaled shining,spotify:track:7Fa5UNizycSms5jP3SQD3F
,193901.0,True,,"DJ Khaled, Drake",,To the Max,4,,2017-06-22,dj khaled to the max,spotify:track:2of5xn0GU0TdFneR1saRLH
,230712.0,True,,"DJ Khaled, JAY Z, Future, Beyoncé",,Top Off,7,,2018-03-02,dj khaled top off,spotify:track:1W6wxOOYyJyyok8fqYSZ3m
,204664.0,True,,"DJ Khaled, Rihanna, Bryson Tiller",,Wild Thoughts (feat. Rihanna & Bryson Tiller),21,,2017-06-22,dj khaled wild thoughts,spotify:track:45XhKYRRkyeqoW3teSOkCM
,219512.0,True,,DJ Luke Nasty,,OTW,2,,2016-05-13,dj luke nasty otw,spotify:track:5qi7piHIt9zwTYYBnIvfNZ
,205946.0,False,,"DJ Snake, Justin Bieber",,Let Me Love You,8,,2016-08-05,dj snake let me love you,spotify:track:0lYBSQXN6rCTvUZvg9S0lU
,129384.0,True,,DJ Suede The Remix God,,Cash Me Outside (#CashmeOutside),3,,2017-01-31,dj suede the remix god cash me outside (#cashmeoutside),spotify:track:1r6cyaW7yMykwSyxTuwcuM
,200480.0,False,,Daddy Yankee,,Dura,21,,2018-01-18,daddy yankee dura,spotify:track:6KuqAtoeVzxAYOaMveLNpH
,192000.0,False,,Dan + Shay,,How Not To,14,,2016-06-03,dan + shay how not to,spotify:track:4n0xztUAbHPUV8G3NQvF30
,195986.0,False,,Dan + Shay,,Tequila,17,,2018-01-10,dan + shay tequila,spotify:track:7Il2yWQmsqKgSkLQvHTPUI
,278179.0,False,,"Daniel Caesar, Kali Uchis",,Get You (feat. Kali Uchis),6,,2017-08-25,daniel caesar get you,spotify:track:7zFXmv6vqI4qOt4yGf3jYZ
,197053.0,False,,Darius Rucker,,For The First Time,10,,2017-10-20,darius rucker for the first time,spotify:track:0LG2cFomCi8Fb664Lvr3Nu
,212320.0,False,,Darius Rucker,,If I Told You,11,,2017-10-20,darius rucker if i told you,spotify:track:4Az17HfqonKSWNsaLgTBeK
,194906.0,False,,"David Guetta, Justin Bieber",,2U,11,,2017-06-09,david guetta 2u,spotify:track:762UXiwEHYY97VL45sAUPR
,229573.0,False,,"David Lee Murphy, Kenny Chesney",,Everything's Gonna Be Alright,11,,2018-04-06,david lee murphy everything's gonna be alright,spotify:track:2NEBP8SXEqwZt2PRdPXXuy
,169853.0,False,,DeJ Loaf,,No Fear,1,,2017-06-16,dej loaf no fear,spotify:track:2H881m3JRA8lpuuwaQL6zy
,197893.0,False,,Demi Lovato,,Sober,1,,2018-06-21,demi lovato sober,spotify:track:0STK94RxUulYqWzwFlyAb5
,203760.0,True,,Demi Lovato,,Sorry Not Sorry,35,,2017-09-29,demi lovato sorry not sorry,spotify:track:7gvd8xj4QgPqbQSsn5pV7d
,203760.0,True,,Demi Lovato,,Sorry Not Sorry,19,,2017-09-29,demi lovato tell me you love me,spotify:track:7gvd8xj4QgPqbQSsn5pV7d
,236032.0,True,,Derez De’Shon,,Hardaway,11,,2017-12-08,derez de'shon hardaway,spotify:track:4hxfqUojJ5u9SyAjiXevmy
,249482.0,False,,Vox Freaks,,It's Goin' Down (Originally Performed by Descendants 2 Cast) [Instrumental Version],4,,2017-07-31,descendants 2 cast it's goin' down,spotify:track:56V4lnkkgjEGkl7rS0R6Jk
,224626.0,False,,Devin Dawson,,All on Me,20,,2018-01-19,devin dawson all on me,spotify:track:2mfahQ0EaaZWq4cFNg6A1o
,197120.0,False,,Dierks Bentley,,Somewhere On A Beach,17,,2016-06-10,dierks bentley black,spotify:track:5CG9Ps5ynNjpKJHmwc95pa
,179826.0,False,,Dierks Bentley,,"Woman, Amen",12,,2018-06-08,"dierks bentley woman, amen",spotify:track:3nBXOlFTADNvG9nkqy2O2W
,181720.0,True,,"Diplo, French Montana, Lil Pump, Zhavia Ward",,"Welcome to the Party (with French Montana & Lil Pump, feat. Zhavia Ward) - from Deadpool 2",4,,2018-05-15,"diplo, french montana welcome to the party",spotify:track:5mqzhMuUpvnMfwNz6iepmO
,186293.0,False,,"Drake, Sampha",,4422,2,,2017-03-18,drake 4422,spotify:track:2fkeWbM6iqTw7oGHTYm2lw
,195720.0,True,,Drake,,8 Out Of 10,1,,2018-06-29,drake 8 out of 10,spotify:track:0zqy3ss4CwD6u4QPksS0nI
,289560.0,True,,"Drake, Static Major, Ty Dolla $ign",,After Dark (feat. Static Major & Ty Dolla $ign),1,,2018-06-29,drake after dark,spotify:track:3mvYQKm8h6M5K5h0nVPY9S
,216557.0,False,,Drake,,Blem,4,,2017-03-18,drake blem,spotify:track:2XlHu0HcujBCkWMdIAvrqt
,162800.0,True,,Drake,,Blue Tint,1,,2018-06-29,drake blue tint,spotify:track:4n1bdaKwynQndm47x5HqWX
,228437.0,True,,Drake,,Can't Have Everything,2,,2017-03-18,drake can't have everything,spotify:track:5f5r2N4Lp9WoULWPH9zp2W
,163974.0,True,,Drake,,Can’t Take A Joke,1,,2018-06-29,drake can't take a joke,spotify:track:1dUHF4RyMmMTveJ0Rby6Xm
,255866.0,True,,Drake,,Diplomatic Immunity,3,,2018-01-20,drake diplomatic immunity,spotify:track:4haJoBPbPj9QFKNpp9e8kx
,283550.0,True,,Drake,,Do Not Disturb,2,,2017-03-18,drake do not disturb,spotify:track:2KvHC9z14GSl4YpkNMX384
