artists,duration_ms,explicit,id,key,modified_query,name,num_weeks,popularity,release_date,search_query,uri
,231375.0,False,,Hit The Button Karaoke,,Criminal (Originally Performed by Natti Natasha X Ozuna) - Karaoke Instrumental Version,3,,2018-02-15,natti natasha x ozuna criminal,spotify:track:08Zs7WozVFhEKiD7yrHwYq
,188174.0,False,,Niall Horan,,Slow Hands,31,,2017-10-20,niall horan slow hands,spotify:track:2cOUlop2ZakjOKe4WinesN
,232852.0,False,,Niall Horan,,This Town,4,,2017-10-20,niall horan this town,spotify:track:0qvzXomUDJVaUboy2wMfiS
,223043.0,True,,Niall Horan,,Too Much To Ask,11,,2017-10-20,niall horan too much to ask,spotify:track:39jXnbACjiaiTwwhsr5sY5
,214760.0,False,,"Nick Jonas, Nicki Minaj",,Bom Bidi Bom,1,,2017-02-10,nick jonas bom bidi bom,spotify:track:4PxDHEEyHgYC6NUgqMtDFy
,191699.0,True,,Nicki Minaj,,Barbie Tingz,4,,2018-04-12,nicki minaj barbie tingz,spotify:track:2qsQ8eVDPmobZpvDxQCVQu
,189533.0,True,,"Nicki Minaj, Ariana Grande",,Bed (feat. Ariana Grande),3,,2018-08-10,nicki minaj bed,spotify:track:3L4GsGLgxpHieVQH86H8bv
,295653.0,True,,"Nicki Minaj, Lil Wayne",,Changed It,1,,2017-03-09,nicki minaj changed it,spotify:track:63NTlJWNS65JjsE3QJYr20
,191600.0,True,,Nicki Minaj,,Chun-Li,13,,2018-08-10,nicki minaj chun-li,spotify:track:1e4rwBPVI32vZtTJu7mJ4J
,229573.0,True,,Nicki Minaj,,Regret In Your Tears,1,,2017-03-09,nicki minaj regret in your tears,spotify:track:0j8zLbIueSkVqB3Tl6PsjA
,192600.0,True,,"Nicki Minaj, Lil Wayne",,Rich Sex (feat. Lil Wayne),1,,2018-08-10,nicki minaj rich sex,spotify:track:2D1MK9oaxy7axXggy3iVbp
,272453.0,True,,"Nicki Minaj, Drake, Lil Wayne",,No Frauds,7,,2017-03-10,"nicki minaj, drake no frauds",spotify:track:7KcGEssn7BnJdTgildK5y0
,219506.0,False,,Nicky Jam,,El Amante,15,,2017-01-20,nicky jam el amante,spotify:track:3umS4y3uQDkqekNjVpiRUs
,173627.0,False,,"Nicky Jam, J Balvin",,X,18,,2018-03-02,nicky jam x j balvin x,spotify:track:39N9RPD9MRb5WmoLzNzPeA
,242081.0,False,,"Noah Cyrus, Labrinth",,Make Me (Cry),8,,2016-11-15,noah cyrus make me (cry),spotify:track:2BrzlUj1u1CtvaJDGIKpsP
,147986.0,True,,"Offset, Metro Boomin",,Nightmare,1,,2017-10-30,offset nightmare,spotify:track:7LAhKXDNWwq3CmnFP3UIOP
,172800.0,True,,"Offset, Metro Boomin",,Ric Flair Drip (& Metro Boomin),30,,2017-10-30,offset ric flair drip,spotify:track:7sO5G9EABYOXQKNPNiE9NR
,166573.0,False,,Old Dominion,,Hotel Key,1,,2017-08-25,old dominion hotel key,spotify:track:33471tzU1VghDg9zNgGRpz
,176893.0,False,,Old Dominion,,No Such Thing as a Broken Heart,19,,2017-08-25,old dominion no such thing as a broken heart,spotify:track:0OlS52TmtK2gPaEtdmr7DN
,184080.0,False,,Old Dominion,,Written in the Sand,19,,2017-08-25,old dominion written in the sand,spotify:track:2A69wys3S9uiPSmn6UZWJn
,258000.0,False,,"Ozuna, Romeo Santos",,El Farsante - Remix,20,,2018-01-30,ozuna el farsante,spotify:track:7uYgVgRSgqluZclLS7wpp4
,269600.0,False,,P!nk,,What About Us,15,,2017-10-13,p!nk beautiful trauma,spotify:track:0Qh38w01QRXK6KHIv0e3hb
,269600.0,False,,P!nk,,What About Us,21,,2017-10-13,p!nk what about us,spotify:track:0Qh38w01QRXK6KHIv0e3hb
,202661.0,False,,PARTYNEXTDOOR,,Not Nice,5,,2016-08-12,partynextdoor not nice,spotify:track:4STaHtfguDMkWbPEo6Fwcx
,190946.0,False,,Panic! At The Disco,,High Hopes,2,,2018-06-22,panic! at the disco high hopes,spotify:track:1rqqCSm0Qe4I9rUvWncaom
,189186.0,False,,Panic! At The Disco,,Say Amen (Saturday Night),3,,2018-06-22,panic! at the disco say amen (saturday night),spotify:track:76vMKwFtdDDCLcM6zXybjB
,182693.0,False,,Paramore,,Hard Times,1,,2017-05-12,paramore hard times,spotify:track:0w5Bdu51Ka25Pf3hojsKHh
,202853.0,False,,"Pharrell Williams, Camila Cabello",,Sangria Wine,1,,2018-05-18,pharrell williams x camila cabello sangria wine,spotify:track:6XlSyYFTU1nodeWwwzVgTV
,181812.0,True,,Playboi Carti,,Magnolia,20,,2017-04-14,playboi carti magnolia,spotify:track:1e1JKLEDKP7hEQzJfNAgPl
,153800.0,True,,"Playboi Carti, Lil Uzi Vert",,Shoota (feat. Lil Uzi Vert),4,,2018-05-11,playboi carti shoota,spotify:track:2BJSMvOGABRxokHKB0OI8i
,235535.0,True,,"Playboi Carti, Lil Uzi Vert",,wokeuplikethis*,10,,2017-04-14,playboi carti wokeuplikethis*,spotify:track:59J5nzL1KniFHnU120dQzt
,231673.0,True,,"Plies, Kodak Black",,Real Hitta (feat. Kodak Black),1,,2017-05-12,plies real hitta,spotify:track:1fnRwgZLgAYMM1dVL1oqwG
,174653.0,True,,Plies,,Rock,5,,2018-03-16,plies rock,spotify:track:0QVISdPWRllAmoDBG3DEHU
,245604.0,True,,PnB Rock,,Selfish,7,,2017-01-13,pnb rock selfish,spotify:track:2xbI8Vmyv3TkpTdywpPyNw
,163253.0,False,,Portugal. The Man,,Feel It Still,44,,2017-06-16,portugal. the man feel it still,spotify:track:6QgjcU0zLnzq5OrUoSZ3OK
,211426.0,True,,Post Malone,,92 Explorer,3,,2018-04-27,post malone 92 explorer,spotify:track:1D2L6MefbXon28PzIk9I3r
,206266.0,True,,"Post Malone, Nicki Minaj",,Ball For Me (feat. Nicki Minaj),10,,2018-04-27,post malone ball for me,spotify:track:6IaieqiCVvsNvEt6Y7yOFa
,231266.0,True,,Post Malone,,Better Now,10,,2018-04-27,post malone better now,spotify:track:7dt6x5M1jzdTEt8oCbisTK
,261800.0,False,,Post Malone,,Blame It On Me,2,,2018-04-27,post malone blame it on me,spotify:track:1ZemPoaj7LBj1RAQrb89EC
,227533.0,True,,Post Malone,,Candy Paint,20,,2018-04-27,post malone candy paint,spotify:track:32lItqlMi4LBhb4k0BaSaC
,220293.0,True,,"Post Malone, Quavo",,Congratulations,45,,2016-12-09,post malone congratulations,spotify:track:3a1lNhkSLSkpJE4MSHpDu9
,179613.0,True,,Post Malone,,Go Flex,10,,2016-12-09,post malone go flex,spotify:track:5yuShbu70mtHXY0yLzCQLQ
,223346.0,True,,Post Malone,,I Fall Apart,29,,2016-12-09,post malone i fall apart,spotify:track:75ZvA4QfFiZvzhj2xkaWAh
,112013.0,False,,Post Malone,,Jonestown (Interlude),1,,2018-04-27,post malone jonestown (interlude),spotify:track:0R6Jlsq25eZB3Wftpxi3oF
,228226.0,True,,Post Malone,,Otherside,2,,2018-04-27,post malone otherside,spotify:track:4qWCFTuNnmGNdY4egtb4ZY
,246986.0,True,,Post Malone,,Over Now,3,,2018-04-27,post malone over now,spotify:track:09IOPhEh1OMe0HD9b36FJk
,221786.0,False,,Post Malone,,Paranoid,6,,2018-04-27,post malone paranoid,spotify:track:3fpVWegR6YOS1Yk5HSMYIq
,221440.0,True,,"Post Malone, Ty Dolla $ign",,Psycho (feat. Ty Dolla $ign),19,,2018-04-27,post malone psycho,spotify:track:3swc6WTsr7rl9DqQKQA55C
,206453.0,True,,Post Malone,,Rich & Sad,6,,2018-04-27,post malone rich & sad,spotify:track:2VdT56BGpdqNHUgOe1j5vc
,218146.0,True,,"Post Malone, 21 Savage",,rockstar (feat. 21 Savage),40,,2018-04-27,post malone rockstar,spotify:track:0e7ipj03S05BNilyu5bRzt
,212466.0,True,,"Post Malone, G-Eazy, YG",,Same Bitches (feat. G-Eazy & YG),3,,2018-04-27,post malone same bitches,spotify:track:688QpQAwqsLdBR6lr13wK1
,194560.0,True,,"Post Malone, Swae Lee",,Spoil My Night (feat. Swae Lee),5,,2018-04-27,post malone spoil my night,spotify:track:5VuxWXbt7XENQCtE9TzpTv
,204426.0,True,,Post Malone,,Stay,4,,2018-04-27,post malone stay,spotify:track:4H7WNRErSbONkM06blBoGc
,228146.0,True,,Post Malone,,Sugar Wraith,1,,2018-04-27,post malone sugar wraith,spotify:track:0MrRAUcB8AZiB9ue2VOBYe
,216746.0,True,,Post Malone,,Takin' Shots,3,,2018-04-27,post malone takin' shots,spotify:track:5ffntNJnJOeFv7b7DCd0Bw
,204360.0,True,,Post Malone,,Zack And Codeine,3,,2018-04-27,post malone zack and codeine,spotify:track:5lZZmityu9TAjNvSY6GLhR
,202120.0,True,,Pusha T,,If You Know You Know,1,,2018-05-25,pusha t if you know you know,spotify:track:6bGwKHXHNLmTy6yt147FPh
,170240.0,True,,Pusha T,,Infrared,1,,2018-05-25,pusha t infrared,spotify:track:6cpsixIHI63L0hwh3CwZg3
,166120.0,True,,Pusha T,,The Games We Play,1,,2018-05-25,pusha t the games we play,spotify:track:7iEoaTyBCqLaAwJnOP1BTn
,153266.0,True,,"Pusha T, Kanye West",,What Would Meek Do?,1,,2018-05-25,pusha t what would meek do?,spotify:track:5vnuJ8EopkP5dHukpOmT3L
,213613.0,True,,"Quality Control, Quavo, Lil Yachty",,Ice Tray,5,,2017-12-08,quavo ice tray,spotify:track:3wdfLVUhmX64lIyWIIEW8s
,176075.0,False,,Queen Naija,,Karma,1,,2018-06-29,queen naija karma,spotify:track:3qmm9AdG0TnShv0drgXNIQ
,219135.0,False,,Queen Naija,,Medicine,5,,2018-06-08,queen naija medicine,spotify:track:4lFfMRH0YH4pW5gczTDbNC
,291893.0,True,,"Rae Sremmurd, Gucci Mane",,Black Beatles,7,,2016-08-12,rae sremmurd black beatles,spotify:track:6fujklziTHa8uoM5OQSfIo
,193510.0,True,,"Rae Sremmurd, Swae Lee, Slim Jxmmi, Travis Scott",,CLOSE (feat. Travis Scott) - From SR3MM,1,,2018-05-04,rae sremmurd close,spotify:track:1oUudyBYVGMIC8JXeIsFzq
,204787.0,True,,"Rae Sremmurd, Swae Lee, Slim Jxmmi",,Perplexing Pegasus - From SR3MM,3,,2018-05-04,rae sremmurd perplexing pegasus,spotify:track:1ung2kajpw24AaHjBtPY3j
,332300.0,True,,"Rae Sremmurd, Swae Lee, Slim Jxmmi, Juicy J",,Powerglide (feat. Juicy J) - From SR3MM,17,,2018-05-04,rae sremmurd powerglide,spotify:track:1BuZAIO8WZpavWVbbq3Lci
,208120.0,True,,Rae Sremmurd,,Swang,20,,2016-08-12,rae sremmurd swang,spotify:track:6mapJIPnQ23RTAevUoE0DL
,200186.0,False,,Rag'n'Bone Man,,Human,7,,2017-02-10,rag'n'bone man human,spotify:track:58zsLZPvfflaiIbNWoA22O
,206826.0,False,,Rascal Flatts,,Yours If You Want It,10,,2017-05-19,rascal flatts yours if you want it,spotify:track:4D4xJ4LyDXBWIf9thFSMAJ
,213577.0,False,,Red Marlow,,I Pray - The Voice Performance,1,,2017-12-20,red marlow i pray,spotify:track:4cF4l5ShMLqMCFeabt8Xa6
,221653.0,False,,"Reik, Ozuna, Wisin",,Me Niego,3,,2018-02-16,reik me niego,spotify:track:6jA8JUuPCGYjFcgw0AoM5T
,155193.0,True,,"Ricegum, Alissa Violet",,Its Every Night Sis,1,,2017-06-09,ricegum its every night sis,spotify:track:15Uxmx6D6hW0gY5kc7bpqU
,191937.0,True,,"Rich The Kid, Kendrick Lamar",,New Freezer (feat. Kendrick Lamar),19,,2018-03-30,rich the kid new freezer,spotify:track:2EgB4n6XyBsuNUbuarr4eG
,175229.0,True,,Rich The Kid,,Plug Walk,20,,2018-03-30,rich the kid plug walk,spotify:track:1ZAyjvIk9YiD76yYy0TEG6
,275720.0,True,,"Rick Ross, Young Thug, Wale",,Trap Trap Trap,1,,2017-03-17,rick ross trap trap trap,spotify:track:1KZ0Xo6Mmeprp1Sw5xCHYz
,224000.0,True,,Rihanna,,Love On The Brain,16,,2016-01-28,rihanna love on the brain,spotify:track:2aksifNn5ph8igDOkPBA02
,206400.0,True,,Rihanna,,Sex With Me,2,,2016-01-28,rihanna sex with me,spotify:track:6WAxKNbZoGNzQTIvdMqkFs
,204700.0,False,,"Romeo Santos, Daddy Yankee, Nicky Jam",,Bella y Sensual,1,,2017-07-21,romeo santos bella y sensual,spotify:track:0ERbK7qVqveCaBWIiYCrl3
,239823.0,False,,Romeo Santos,,Héroe Favorito,1,,2017-07-21,romeo santos heroe favorito,spotify:track:6BdAwMv1YorLfkBWlE493X
,234828.0,False,,Romeo Santos,,Imitadora,1,,2017-07-21,romeo santos imitadora,spotify:track:6r46lnXFbE9fr2d3KNaGbe
,237506.0,True,,Russ,,Losin Control,19,,2017-05-05,russ losin control,spotify:track:4cxMGhkinTocPSVVKWIw0d
,216960.0,False,,Russell Dickerson,,Yours,19,,2017-10-13,russell dickerson yours,spotify:track:6RSNKGdv3nDTHqgw4bdzyF
,219306.0,True,,SOB X RBE,,Paramedic!,4,,2018-02-09,sob x rbe paramedic!,spotify:track:2tPcTFiQF9MbVUyjZ3zDhA
,231253.0,True,,SZA,,Broken Clocks,4,,2017-06-09,sza broken clocks,spotify:track:2fXwCWkh6YG5zU1IyvQrbs
,275080.0,True,,"SZA, Travis Scott",,Love Galore (feat. Travis Scott),20,,2017-06-09,sza love galore,spotify:track:0q75NwOoFiARAVp4EXU4Bs
,272186.0,True,,SZA,,The Weekend,24,,2017-06-09,sza the weekend,spotify:track:6gU9OKjOE7ghfEd55oRO57
,193181.0,False,,Sage The Gemini,,Now and Later,1,,2017-07-21,sage the gemini now & later,spotify:track:08WPvDEsHvTFuB9w8tC2OS
,165386.0,False,,Sam Hunt,,Body Like A Back Road,41,,2017-02-01,sam hunt body like a back road,spotify:track:7mldq42yDuxiUNn08nvzHO
,213986.0,False,,Sam Hunt,,Downtown's Dead,2,,2018-05-16,sam hunt downtown's dead,spotify:track:5eFfsbjSouG8qOpg9ZqDl6
,221595.0,True,,Sam Smith,,Pray,2,,2017-11-03,sam smith pray,spotify:track:59ljpSFcgtfWJKS3vqG27R
,201000.0,False,,Sam Smith,,Too Good At Goodbyes,23,,2017-11-03,sam smith too good at goodbyes,spotify:track:3VlbOrM6nYPprVvzBZllE5
,267426.0,True,,"ScHoolboy Q, 2 Chainz, Saudi",,X (with 2 Chainz & Saudi),5,,2018-02-09,"schoolboy q, 2 chainz x",spotify:track:4LmAnpjlhWTahvRkYR8xJa
,238954.0,False,,Scotty McCreery,,Five More Minutes,19,,2017-05-05,scotty mccreery five more minutes,spotify:track:66IULVOTImQG2u0cJ3Ls04
,207904.0,False,,Selena Gomez,,Back To You - From 13 Reasons Why – Season 2 Soundtrack,8,,2018-05-10,selena gomez back to you,spotify:track:4hQ6UGyWQIGJmHSo0J88JW
,214647.0,False,,Selena Gomez,,Bad Liar,14,,2017-05-18,selena gomez bad liar,spotify:track:2fZQIJew3nkNe99s2PKzul
,186112.0,False,,"Selena Gomez, Gucci Mane",,Fetish (feat. Gucci Mane),12,,2017-07-13,selena gomez fetish,spotify:track:4lnAN2S1fcI0SjxEbksZVr
,195840.0,False,,"Shakira, Maluma",,Chantaje (feat. Maluma),7,,2017-05-26,shakira chantaje,spotify:track:6mICuAdrwEjh6Y6lroV2Kg
,226893.0,False,,Shakira,,Me Enamoré,2,,2017-05-26,shakira me enamore,spotify:track:4qknM1pQz53QOyfDVTjcM9
,195213.0,False,,"Shakira, Nicky Jam",,Perro Fiel (feat. Nicky Jam),1,,2017-05-26,shakira perro fiel,spotify:track:70lnL3QaSOIIyMa2X9aVRL
,211360.0,False,,Shawn Mendes,,In My Blood,16,,2018-05-25,shawn mendes in my blood,spotify:track:2QZ7WLBE8h2y1Y5Fb8RYbH
,201200.0,False,,Shawn Mendes,,Lost In Japan,1,,2018-05-25,shawn mendes lost in japan,spotify:track:79esEXlqqmq0GPz0xQSZTV
,208733.0,False,,Shawn Mendes,,Mercy,13,,2017-04-20,shawn mendes mercy,spotify:track:0AS63m1wHv9n4VVRizK6Hc
,199440.0,False,,Shawn Mendes,,There's Nothing Holdin' Me Back,34,,2017-04-20,shawn mendes there's nothing holdin' me back,spotify:track:7JJmb5XwzOO8jgpou264Ml
,187973.0,False,,Shawn Mendes,,Treat You Better,5,,2017-04-20,shawn mendes treat you better,spotify:track:3QGsuHI8jO1Rx4JWLUh9jd
,190866.0,False,,"Shawn Mendes, Khalid",,Youth (feat. Khalid),2,,2018-05-25,shawn mendes youth,spotify:track:1h0yImRPIVAjhhHeNVlTuC
,211666.0,False,,Sia,,Cheap Thrills,2,,2016-10-21,sia cheap thrills,spotify:track:3S4px9f4lceWdKf0gWciFu
,252320.0,False,,Sia,,Helium,1,,2017-02-10,sia helium,spotify:track:4S6fv0puLCsfYjyBTPDb9k
,210226.0,False,,"Sia, Kendrick Lamar",,The Greatest,2,,2016-10-21,sia the greatest,spotify:track:7xHWNBFm6ObGEQPaUxHuKO
,184880.0,True,,"Sofi Tukker, NERVO, The Knocks, ALISA UENO",,"Best Friend (feat. NERVO, The Knocks & ALISA UENO)",5,,2018-04-13,sofi tukker best friend,spotify:track:6twQJ2KMwNzODCY0HzXP2E
,193792.0,False,,"Sofia Carson, Cameron Boyce, Booboo Stewart, Mitchell Hope",,Chillin' Like a Villain,1,,2017-07-21,"sofia carson, cameron boyce, booboo stewart chillin' like a villain",spotify:track:1rM0CnyUiiw6A9CHJRXjZA
,222040.0,False,,"Starley, Ryan Riback",,Call on Me - Ryan Riback Remix,14,,2016-10-18,starley call on me,spotify:track:2L6orAlH8tBhiFTumIfMyF
,215106.0,False,,"Sugarland, Taylor Swift",,Babe,2,,2018-06-08,sugarland babe,spotify:track:7fRruZ12gXGwBs0zXQ6e5V
,256341.0,True,,"Rae Sremmurd, Swae Lee, Slim Jxmmi",,Guatemala - From Swaecation,1,,2018-05-04,swae lee guatemala,spotify:track:0TCnOEVeLQMXOUrpPlM7uY
,309120.0,True,,Tank,,When We,20,,2017-09-29,tank when we,spotify:track:2HWelwHQS4EdRqIycZOc3O
,140000.0,True,,Tay-K,,The Race,19,,2017-12-14,tay-k the race,spotify:track:3wGXyJGsCf1myH5MooQIqE
,208186.0,False,,Taylor Swift,,...Ready For It?,19,,2017-11-10,taylor swift ...ready for it?,spotify:track:2yLa0QULdQr0qAIvVwN6B5
,203506.0,False,,Taylor Swift,,Call It What You Want,2,,2017-11-10,taylor swift call it what you want,spotify:track:1GwMQaZz6Au3QLDbjbMdme
,232253.0,False,,Taylor Swift,,Delicate,17,,2017-11-10,taylor swift delicate,spotify:track:6NFyWDv5CjfwuzoCkw47Xf
,244826.0,False,,"Taylor Swift, Ed Sheeran, Future",,End Game,13,,2017-11-10,taylor swift end game,spotify:track:2x0WlnmfG39ZuDmstl9xfX
,209680.0,False,,Taylor Swift,,Gorgeous,4,,2017-11-10,taylor swift gorgeous,spotify:track:1ZY1PqizIl78geGM4xWlEA
,211853.0,False,,Taylor Swift,,Look What You Made Me Do,19,,2017-11-08,taylor swift look what you made me do,spotify:track:1JbR9RDP3ogVNEWFgNXAjh
,254693.0,True,,Tee Grizzley,,First Day Out,20,,2017-04-07,tee grizzley first day out,spotify:track:3muBQDekYAg7jm6hDu6R0Z
,264853.0,False,,The Carters,,APES**T,3,,2018-06-15,the carters apes**t,spotify:track:0B08s1tLWCXoFmGP0vIubM
,244133.0,True,,The Carters,,BOSS,2,,2018-06-16,the carters boss,spotify:track:4F8V44j8cbjHnXjfW2HruU
,344293.0,True,,The Carters,,FRIENDS,1,,2018-06-16,the carters friends,spotify:track:0gu5B9dUOiLezdDjrLPCCV
,233680.0,True,,The Carters,,NICE,1,,2018-06-16,the carters nice,spotify:track:44lusH2vzc4sRAwsooRhPh
,285200.0,False,,The Carters,,SUMMER,1,,2018-06-16,the carters summer,spotify:track:54vcvhmByc2BC4k9JDcQrj
,244960.0,False,,"The Chainsmokers, Halsey",,Closer,26,,2016-07-29,the chainsmokers closer,spotify:track:7BKLCZ1jbUBVqRi2FVlTVw
,208373.0,False,,"The Chainsmokers, Daya",,Don't Let Me Down,2,,2016-02-05,the chainsmokers don't let me down,spotify:track:1i1fxkWeaMmKEB4T7zqbzK
,223466.0,False,,The Chainsmokers,,Everybody Hates Me,1,,2018-12-14,the chainsmokers everybody hates me,spotify:track:6ufrOaf4v6Qady6GiIpQ0s
,208000.0,False,,The Chainsmokers,,Honest,4,,2017-04-07,the chainsmokers honest,spotify:track:6KjbNLbRjuoa8rEq5yNA6H
,221520.0,False,,The Chainsmokers,,Paris,18,,2017-01-13,the chainsmokers paris,spotify:track:15vzANxN8G9wWfwAJLLMCg
,197946.0,False,,"The Chainsmokers, Kelsea Ballerini",,This Feeling,3,,2018-12-14,the chainsmokers sick boy,spotify:track:4NBTZtAt1F13VvlSKe6KTl
,247160.0,False,,"The Chainsmokers, Coldplay",,Something Just Like This,39,,2017-04-07,the chainsmokers something just like this,spotify:track:6RUKPb4LETWmmr3iAEQktW
,177573.0,True,,The Chainsmokers,,The One,2,,2017-04-07,the chainsmokers the one,spotify:track:0wfbD5rAksdXUzRvMfM3x5
,274093.0,False,,The Revivalists,,Wish I Knew You,9,,2015-07-15,the revivalists wish i knew you,spotify:track:2EWpa5XnAuSn0sIkSSIhYk
,228373.0,False,,The Weeknd,,Call Out My Name,14,,2018-03-30,the weeknd call out my name,spotify:track:4MPTj8lMMvxLwT3EwuXFop
,230026.0,True,,"The Weeknd, Gesaffelstein",,Hurt You,1,,2018-03-30,the weeknd hurt you,spotify:track:13wNEvWmBsWaWVtiLPRIW5
,269186.0,False,,"The Weeknd, Daft Punk",,I Feel It Coming,16,,2016-11-25,the weeknd i feel it coming,spotify:track:3dhjNA0jGA8vHBQ1VdD6vV
,241066.0,False,,"The Weeknd, Gesaffelstein",,I Was Never There,1,,2018-03-30,the weeknd i was never there,spotify:track:5rgnyXr2PXFWsAnPFew077
,249213.0,True,,The Weeknd,,Party Monster,9,,2016-11-25,the weeknd party monster,spotify:track:4F7A0DXBrmUAkp32uenhZt
,211440.0,True,,"The Weeknd, Kendrick Lamar",,Pray For Me (with Kendrick Lamar),20,,2018-02-09,the weeknd pray for me,spotify:track:77UjLW8j5UAGAGVGhR5oUK
,170573.0,True,,The Weeknd,,Privilege,1,,2018-03-30,the weeknd privilege,spotify:track:26Fqtv4Aa7kyd1WWGHai6A
,218880.0,True,,The Weeknd,,Reminder,13,,2016-11-25,the weeknd reminder,spotify:track:37F0uwRSrdzkBiuj0D5UHI
,230453.0,True,,"The Weeknd, Daft Punk",,Starboy,11,,2016-11-25,the weeknd starboy,spotify:track:7MXVkk9YMctZqd1Srtv4MB
,221106.0,False,,The Weeknd,,Try Me,2,,2018-03-30,the weeknd try me,spotify:track:4rv1ww0dUwFZcDVPqhcOcX
,220293.0,True,,The Weeknd,,Wasted Times,3,,2018-03-30,the weeknd wasted times,spotify:track:72TyiiduRmczEbDIEtKQdR
,223626.0,False,,"Thomas Rhett, Maren Morris",,Craving You,20,,2017-09-07,thomas rhett craving you,spotify:track:17hd4ptJCbsEeLj0auPcwy
,205453.0,False,,Thomas Rhett,,Marry Me,2,,2017-09-08,thomas rhett life changes,spotify:track:0OWZFobGSIW9GrSlQ9C5pc
,205453.0,False,,Thomas Rhett,,Marry Me,19,,2017-09-08,thomas rhett marry me,spotify:track:0OWZFobGSIW9GrSlQ9C5pc
,181200.0,False,,Thomas Rhett,,Star Of The Show,6,,2016-10-28,thomas rhett star of the show,spotify:track:63OQWdXMq0Pe6pRpWY5gO0
,157080.0,False,,Thomas Rhett,,Unforgettable,20,,2017-09-08,thomas rhett unforgettable,spotify:track:30MM5jWpUmOxtTNd9Ey5LZ
,232160.0,False,,"Tim McGraw, Faith Hill",,Speak to a Girl,2,,2017-11-17,tim mcgraw speak to a girl,spotify:track:421ebjYqaIXEG2KloTbXlH
,225360.0,False,,"Tim McGraw, Faith Hill",,The Rest of Our Life,1,,2017-11-17,tim mcgraw the rest of our life,spotify:track:19P6cJstaoQJHtHW3HOGcg
,243253.0,False,,Train,,Play That Song,11,,2017-01-27,train play that song,spotify:track:77hjM9bMmgfTGJXv14UFmi
,190557.0,False,,Travis Scott,,BUTTERFLY EFFECT,22,,2018-08-03,travis scott butterfly effect,spotify:track:2cYqizR4lgvp4Qu6IQ3qGN
,243836.0,True,,Travis Scott,,goosebumps,22,,2016-09-16,travis scott goosebumps,spotify:track:6gBFPUFcJLzWGx4lenP6h2
,217405.0,True,,"Travis Scott, Lil Uzi Vert, Kanye West",,Watch (feat. Lil Uzi Vert & Kanye West),5,,2018-05-04,travis scott watch,spotify:track:3DoBTwfr8yi2LN08SBpFkN
,229013.0,False,,Trey Songz,,Nobody Else But You,3,,2017-03-24,trey songz nobody else but you,spotify:track:1HOUzEsetdIPSpAgRPhZQt
,256162.0,True,,"Trippie Redd, Travis Scott",,Dark Knight Dummo (Feat. Travis Scott),7,,2017-12-05,trippie redd dark knight dummo,spotify:track:3YeJXuRSNS5FYwOsDu44kD
,204726.0,False,,Troye Sivan,,My My My!,1,,2018-08-31,troye sivan my my my!,spotify:track:4NiehSBQthimPzRsVeOgCT
,232959.0,True,,"Tyga, Offset",,Taste (feat. Offset),6,,2018-05-16,tyga taste,spotify:track:5IaHrVsrferBYDm0bDyABy
,151026.0,True,,"Tyler, The Creator",,OKRA,1,,2018-03-30,"tyler, the creator okra",spotify:track:74ZovzRxHBvCq5yIwe8boh
,205093.0,True,,"Tyler, The Creator, A$AP Rocky",,Who Dat Boy,1,,2017-07-21,"tyler, the creator who dat boy",spotify:track:21yRtB6B8EMounImAfHRCP
,261371.0,False,,WALK THE MOON,,One Foot,8,,2017-09-22,walk the moon one foot,spotify:track:3yWsWi2PAo9s6elIhnywIS
,197840.0,False,,Walker Hayes,,You Broke Up with Me,18,,2017-01-27,walker hayes you broke up with me,spotify:track:6UsoV6X96Rox9mfxoz7SFy
,238626.0,False,,Weezer,,Africa,1,,2019-01-24,weezer africa,spotify:track:3ZPKocroJIcnHGcnJVlLKD
,262960.0,False,,Wham!,,Last Christmas,2,,1984,wham! last christmas,spotify:track:2FRnf9qhLbvw8fu4IBXx78
,232786.0,False,,"Wisin, Ozuna",,Escápate Conmigo (feat. Ozuna),20,,2017-12-01,wisin escapate conmigo,spotify:track:1KSqYYJFyfTecXFk9M0prc
,200773.0,True,,"Wiz Khalifa, Ty Dolla $ign",,Something New (feat. Ty Dolla $ign),1,,2018-07-13,wiz khalifa something new,spotify:track:6u8hSdYZxbK5EczDPRIXXf
,129720.0,True,,XXXTENTACION,,Carry On,1,,2017-08-25,xxxtentacion carry on,spotify:track:2yZax79pOrYuyIFVW2cZY2
,121886.0,False,,XXXTENTACION,,changes,12,,2018-03-16,xxxtentacion changes,spotify:track:7AFASza1mXqntmGtbxXprO
,144733.0,True,,XXXTENTACION,,Depression & Obsession,1,,2017-08-25,xxxtentacion depression & obsession,spotify:track:2H3wWrnO758y0fPH7Ilerg
,95466.0,True,,XXXTENTACION,,Everybody Dies In Their Nightmares,7,,2017-08-25,xxxtentacion everybody dies in their nightmares,spotify:track:3GVkPk8mqxz0itaAriG1L7
,115194.0,True,,XXXTENTACION,,going down!,1,,2018-03-16,xxxtentacion going down!,spotify:track:7CkbRn6S0itJqcqn88AtSV
,110886.0,True,,XXXTENTACION,,Hope,2,,2018-03-16,xxxtentacion hope,spotify:track:2ZRo7axmMPeSVUvDbGkJah
,176590.0,True,,"XXXTENTACION, Joey Bada$$",,infinity (888) - feat. Joey Bada$$,1,,2018-03-16,xxxtentacion infinity (888),spotify:track:7J2gyNghNTzl4EsLhXp01Q
,119133.0,True,,XXXTENTACION,,Jocelyn Flores,19,,2017-08-25,xxxtentacion jocelyn flores,spotify:track:7m9OqQk4RVRkw9JJdeAw96
,126345.0,True,,XXXTENTACION,,Look At Me!,20,,2017-02-20,xxxtentacion look at me!,spotify:track:7floNISpH8VF4z4459Qo18
,135090.0,True,,XXXTENTACION,,Moonlight,12,,2018-03-16,xxxtentacion moonlight,spotify:track:0JP9xo3adEtGSdUEISiszL
,186267.0,False,,XXXTENTACION,,NUMB,3,,2018-03-16,xxxtentacion numb,spotify:track:01TnVDiet1DFTsyWKUKovl
,120026.0,True,,XXXTENTACION,,Revenge,2,,2017-08-25,xxxtentacion revenge,spotify:track:5TXDeTFVRVY7Cvt0Dw4vWW
,166605.0,True,,XXXTENTACION,,SAD!,18,,2018-03-16,xxxtentacion sad!,spotify:track:3ee8Jmje8o58CHK66QrVC2
,163201.0,True,,XXXTENTACION,,Save Me,1,,2017-08-25,xxxtentacion save me,spotify:track:2UwbhMie1EAYuTZ0QXeMwl
,159915.0,True,,YBN Nahmir,,Rubbin Off The Paint,16,,2018-09-07,ybn nahmir rubbin off the paint,spotify:track:6V4KHt9xu4TPEnDFoBeacT
,197170.0,True,,"YFN Lucci, PnB Rock",,Everyday We Lit (feat. PnB Rock),20,,2017-03-03,yfn lucci everyday we lit,spotify:track:4PzovBqgnSHKd8opsP7IVM
,237240.0,True,,"YG, 2 Chainz, Big Sean, Nicki Minaj",,"BIG BANK (feat. 2 Chainz, Big Sean, Nicki Minaj)",5,,2018-08-03,yg big bank,spotify:track:0ZNrc4kNeQYD9koZ3KvCsy
,149241.0,True,,Yo Gotti,,Juice,5,,2017-10-27,yo gotti juice,spotify:track:1psC5iHzQxaTMZ5dWGfM6I
,276333.0,True,,"Yo Gotti, Nicki Minaj",,Rake It Up,22,,2017-10-27,yo gotti rake it up,spotify:track:4knL4iPxPOZjQzTUlELGSY
,254946.0,True,,"Young Thug, Nicki Minaj",,Anybody (feat. Nicki Minaj),1,,2018-04-13,young thug anybody,spotify:track:5I30ByMf5nhgbSokY1EZiN
,215306.0,True,,"Young Thug, Future",,Relationship (feat. Future),14,,2017-06-16,young thug relationship,spotify:track:25oOaleife6E2MIKmFkPvg
,162488.0,True,,YoungBoy Never Broke Again,,Diamond Teeth Samurai,5,,2018-06-29,youngboy never broke again diamond teeth samurai,spotify:track:1k7KigfkZh2Xb6khqV1a0K
,160000.0,True,,YoungBoy Never Broke Again,,No Smoke,17,,2017-08-04,youngboy never broke again no smoke,spotify:track:57IRaiAB4hBZu3gnNVZC0v
,129105.0,True,,YoungBoy Never Broke Again,,Outside Today,19,,2018-06-29,youngboy never broke again outside today,spotify:track:3sA7HKGzcKTVscdiTCrWpX
,176990.0,True,,YoungBoy Never Broke Again,,Overdose,9,,2018-06-29,youngboy never broke again overdose,spotify:track:3A1BaBGT3HgzuDrV9pgX9v
,236070.0,True,,YoungBoy Never Broke Again,,Preach,1,,2018-06-29,youngboy never broke again preach,spotify:track:45RbAX2KxbPdNwUgeYA69j
,180705.0,True,,YoungBoy Never Broke Again,,Untouchable,2,,2017-05-31,youngboy never broke again untouchable,spotify:track:4MofYf0f4ijlVV6elUW5S3
,227222.0,False,,Zac Brown Band,,My Old Man,4,,2017-05-12,zac brown band my old man,spotify:track:6OzujJBXwYPxJ7KeqflLtr
,217440.0,False,,"Zac Efron, Zendaya",,Rewrite The Stars,7,,2017-12-08,zac efron rewrite the stars,spotify:track:65fpYBrI8o2cfrwf2US4gq
,144244.0,False,,"Zay Hilfigerrr, Zayion McCall",,Juju On That Beat (TZ Anthem),3,,2016-09-30,zay hilfigerrr juju on that beat (tz anthem),spotify:track:1lItf5ZXJc1by9SbPeljFd
