artists,duration_ms,explicit,id,key,modified_query,name,num_weeks,popularity,release_date,search_query,uri
,230600.0,False,,Keith Urban,,Blue Ain't Your Color,1,,2016-05-06,keith urban blue ain't your color,spotify:track:6wycnu8FWXsj68ig7BEot9
,213938.0,False,,"Keith Urban, Julia Michaels",,Coming Home,2,,2018-04-27,keith urban coming home,spotify:track:4pWb8UZ6IPVJA3CPjCNgzq
,195316.0,False,,Keith Urban,,Female,6,,2018-04-27,keith urban female,spotify:track:1t34UsQ634a233qysq6D6L
,184040.0,False,,"Keith Urban, Carrie Underwood",,The Fighter,22,,2016-05-06,keith urban the fighter,spotify:track:5OUSPcqhYTOzpbXzoEvKim
,172426.0,False,,Kelly Clarkson,,Love So Soft,13,,2017-10-27,kelly clarkson love so soft,spotify:track:16QN8cBubEq706vNtPpOME
,244466.0,False,,Kelsea Ballerini,,Legends,11,,2018-10-26,kelsea ballerini legends,spotify:track:6vlxmQGwmlyp07YjkugV6K
,194413.0,False,,Kelsea Ballerini,,Yeah Boy,13,,2015-05-18,kelsea ballerini yeah boy,spotify:track:2WaOQWSv0D1tZNxyLvnGAI
,232186.0,True,,"Kendrick Lamar, SZA",,All The Stars (with SZA),21,,2018-02-09,kendrick lamar all the stars,spotify:track:3GCdLUSnKSMJhs4Tj6CV3s
,221826.0,True,,"Kendrick Lamar, Travis Scott",,Big Shot (with Travis Scott),2,,2018-02-09,kendrick lamar big shot,spotify:track:5cXg9IQS34FzLVdHhp7hu7
,211440.0,True,,"The Weeknd, Kendrick Lamar",,Pray For Me (with Kendrick Lamar),1,,2018-02-09,kendrick lamar black panther,spotify:track:77UjLW8j5UAGAGVGhR5oUK
,118066.0,True,,Kendrick Lamar,,BLOOD.,1,,2017-04-14,kendrick lamar blood.,spotify:track:1n4jwRVXdkK2U34nBDUKKT
,185946.0,True,,Kendrick Lamar,,DNA.,20,,2017-04-14,kendrick lamar dna.,spotify:track:6HZILIRieu8S0iqY8kIKhj
,248613.0,True,,Kendrick Lamar,,DUCKWORTH.,1,,2017-04-14,kendrick lamar duckworth.,spotify:track:0y9uTzK9cNKSAEHnpeRG8C
,208733.0,True,,Kendrick Lamar,,ELEMENT.,11,,2017-04-14,kendrick lamar element.,spotify:track:1EaKU4dMbesXXd3BrLCtYG
,460573.0,True,,Kendrick Lamar,,FEAR.,2,,2017-04-14,kendrick lamar fear.,spotify:track:23luOrEVHMfoX0AhfbQuS6
,214826.0,True,,Kendrick Lamar,,FEEL.,2,,2017-04-14,kendrick lamar feel.,spotify:track:2LTlO3NuNVN70lp2ZbVswF
,248826.0,True,,Kendrick Lamar,,GOD.,2,,2017-04-14,kendrick lamar god.,spotify:track:5p3NP9mQblDsVJLdfNZJ3I
,177000.0,True,,Kendrick Lamar,,HUMBLE.,37,,2017-04-14,kendrick lamar humble.,spotify:track:7KXjTSCq5nL1LoYtL7XAwS
,213400.0,True,,"Kendrick Lamar, Zacari",,LOVE. FEAT. ZACARI.,39,,2017-04-14,kendrick lamar love.,spotify:track:6PGoSes0D9eUDeeAafB2As
,227360.0,True,,"Kendrick Lamar, Rihanna",,LOYALTY. FEAT. RIHANNA.,26,,2017-04-14,kendrick lamar loyalty.,spotify:track:6SwRhMLwNqEi6alNPVG00n
,307880.0,True,,Kendrick Lamar,,LUST.,2,,2017-04-14,kendrick lamar lust.,spotify:track:06FCvd7rrRcF3DdvWH5Isp
,275253.0,True,,Kendrick Lamar,,PRIDE.,2,,2017-04-14,kendrick lamar pride.,spotify:track:6IZvVAP7VPPnsGX6bvgkqg
,289869.0,False,,Karaoke Pro,,The Heart Part 4 (Originally Performed by Kendrick Lamar) - Instrumental Version,2,,2017-04-12,kendrick lamar the heart part 4,spotify:track:3VZf7aAduaJnQjqTIinfCv
,254200.0,True,,"Kendrick Lamar, U2",,XXX. FEAT. U2.,3,,2017-04-14,kendrick lamar xxx.,spotify:track:4iYRa2btalAzPZoSYfROqF
,160293.0,True,,Kendrick Lamar,,YAH.,3,,2017-04-14,kendrick lamar yah.,spotify:track:4BHSjbYylfOH5WAGusDyni
,212893.0,False,,Kenny Chesney,,All the Pretty Girls,14,,2017-04-28,kenny chesney all the pretty girls,spotify:track:66pxmg3Jhjm09tHoWR1wVR
,207306.0,False,,Kenny Chesney,,Bar at the End of the World,1,,2017-04-28,kenny chesney bar at the end of the world,spotify:track:2flWhcGYxQHhb1EeeU2dOL
,199625.0,False,,Kenny Chesney,,Get Along,13,,2018-07-27,kenny chesney get along,spotify:track:6n6OQfBpCgzF9oEg8zhBN7
,217546.0,False,,Kesha,,Learn To Let Go,1,,2017-08-11,kesha learn to let go,spotify:track:1g1TeDflB6atAy7HKwrzXu
,230266.0,False,,Kesha,,Praying,21,,2017-08-11,kesha praying,spotify:track:0jdny0dhgjUwoIp5GkqEaA
,196360.0,True,,"Kesha, The Dap-Kings Horns",,Woman,1,,2017-08-11,kesha woman,spotify:track:1kJtfldK9F7XmsSiSNlbth
,205861.0,True,,Kevin Gates,,Change Lanes,1,,2018-05-16,kevin gates change lanes,spotify:track:59XHPyb0MTMElZpkG0Wp69
,195455.0,True,,Kevin Gates,,Let It Sing,1,,2018-05-16,kevin gates let it sing,spotify:track:090R9OdFMbQQksvwuXmNEY
,219080.0,False,,Khalid,,Location,40,,2017-04-27,khalid location,spotify:track:152lZdxL1OR0ZMW6KquMif
,201707.0,False,,"Khalid, Normani",,Love Lies (with Normani),20,,2018-02-14,khalid love lies,spotify:track:45Egmo7icyopuzJN0oMEdk
,238893.0,True,,"Khalid, Swae Lee",,The Ways (with Swae Lee),3,,2018-02-09,khalid the ways,spotify:track:5jyyPsIGM2yqkZN9R3TmvN
,202546.0,False,,Khalid,,Young Dumb & Broke,35,,2017-04-27,khalid young dumb & broke,spotify:track:5Z3GHaZ6ec9bsiI5BenrbY
,263013.0,True,,"Khalid, 6LACK, Ty Dolla $ign",,OTW,10,,2018-04-20,"khalid, ty dolla $ign otw",spotify:track:6Hgh47WXVKtXN5zGOu0hjI
,154706.0,False,,Kip Moore,,More Girls Like You,12,,2017-09-08,kip moore more girls like you,spotify:track:73WWkaWkIRSP3MYGZ14aY4
,264531.0,True,,"Kodak Black, Lil Wayne",,Codeine Dreaming (feat. Lil Wayne),13,,2017-11-24,kodak black codeine dreaming,spotify:track:4DTpngLjoHj5gFxEZFeD3J
,219753.0,True,,"Kodak Black, Future",,Conscience (feat. Future),1,,2017-03-31,kodak black conscience,spotify:track:16dXg2YuFOxwDC3cTf5jde
,186592.0,True,,Kodak Black,,Everything 1k,1,,2016-06-10,kodak black everything 1k,spotify:track:78AucGxdmVa4Bx6HwDPOS4
,180000.0,True,,Kodak Black,,First Day Out,1,,2017-06-16,kodak black first day out,spotify:track:7AAnFzBtOlgoYceCQoLRUR
,198109.0,True,,Kodak Black,,Patty Cake,3,,2017-03-31,kodak black patty cake,spotify:track:0bXFIF7iL17TYLyx8JHziM
,213132.0,True,,"Kodak Black, XXXTENTACION",,Roll In Peace (feat. XXXTENTACION),25,,2017-08-18,kodak black roll in peace,spotify:track:40oKW22ZNNkEdZLJTScaQI
,169344.0,True,,Kodak Black,,Transportin',16,,2017-08-18,kodak black transportin',spotify:track:1WIZiOuNO3woKfdlSK2gNn
,268186.0,True,,Kodak Black,,Tunnel Vision,20,,2017-03-31,kodak black tunnel vision,spotify:track:4Q3N4Ct4zCuIHuZ65E3BD4
,228661.0,False,,Kris Wu,,Like That,1,,2018-05-18,kris wu like that,spotify:track:4caEPudXQ1xDd1garjHPFv
,193320.0,False,,"Kygo, Imagine Dragons",,Born To Be Yours,2,,2018-06-15,kygo born to be yours,spotify:track:0WVAQaxrT0wsGEG4BCVSn2
,193511.0,False,,"Kygo, Ellie Goulding",,First Time,1,,2017-04-28,kygo first time,spotify:track:2Gl0FzuLxflY6nPifJp5Dr
,222573.0,False,,LANCO,,Greatest Love Story,20,,2018-01-19,lanco greatest love story,spotify:track:2yQZwi1P8AkkxxFhQ8rMEK
,181000.0,False,,Lady Antebellum,,You Look Good,20,,2017-06-09,lady antebellum you look good,spotify:track:1dFLowBW25EaL2OC7eKEa2
,294573.0,True,,Lady Gaga,,Bad Romance,1,,2009,lady gaga bad romance,spotify:track:5P5cGNzqh6A353N3ShDK6Y
,205280.0,False,,Lady Gaga,,Million Reasons,9,,2016-10-21,lady gaga million reasons,spotify:track:7dZ1Odmx9jWIweQSatnRqo
,211363.0,False,,Lady Gaga,,The Cure,14,,2017-04-16,lady gaga the cure,spotify:track:34oB5r0lcN3fYWCs2uA1k5
,272742.0,False,,Lana Del Rey,,Love,2,,2017-07-21,lana del rey love,spotify:track:2Kerz9H9IejzeIpjhDJoYG
,272742.0,False,,Lana Del Rey,,Love,1,,2017-07-21,lana del rey lust for life,spotify:track:2Kerz9H9IejzeIpjhDJoYG
,216266.0,False,,Lauren Alaina,,Road Less Traveled,11,,2017-01-27,lauren alaina road less traveled,spotify:track:4nxgA1nvXvTkmsBY0vJV57
,187823.0,False,,Lauren Duski,,Deja Vu - The Voice Performance,1,,2017-05-24,lauren duski deja vu,spotify:track:4xTNksNuXORn62bGXsGZXd
,212757.0,False,,Lauren Duski,,Ghost In This House - The Voice Performance,1,,2017-05-24,lauren duski ghost in this house,spotify:track:6cl1vl6OU6RLr1C56wOn21
,210732.0,False,,Lauren Duski,,The Dance - The Voice Performance,1,,2017-05-24,lauren duski the dance,spotify:track:1HQtmjBwA4257dxNTvG5Rt
,197436.0,False,,Lauv,,I Like Me Better,21,,2017-05-19,lauv i like me better,spotify:track:1wjzFQodRWrPcQ0AnYnvQ9
,198973.0,False,,Lee Brice,,Boy,1,,2017-11-03,lee brice boy,spotify:track:7A8OfzqXBHYGk61FZTHoeo
,188346.0,False,,Liam Payne,,Bedroom Floor,1,,2017-10-20,liam payne bedroom floor,spotify:track:1OG4nxGMy72EklX2DwcN3Z
,244600.0,False,,"Liam Payne, Rita Ora",,For You (Fifty Shades Freed),3,,2018-11-23,liam payne for you (fifty shades freed),spotify:track:1YQPmgqj0dhqOcrkfuHHKj
,204502.0,False,,"Liam Payne, Quavo",,Strip That Down,28,,2017-05-18,liam payne strip that down,spotify:track:4Ro98RCK90oHqqSZUnTFq5
,247054.0,True,,"Lil Baby, Gunna, Lil Uzi Vert",,Life Goes On,6,,2018-05-18,lil baby life goes on,spotify:track:2bSk87AVkCIIC3Bcligq1z
,317701.0,True,,"Quality Control, Lil Baby, Kodak Black, Quavo, Moneybagg Yo",,My Dawg,6,,2017-12-08,lil baby my dawg,spotify:track:49K3jbwZmZKaDGTfjpIVg0
,173437.0,True,,Lil Baby,,Southside,1,,2018-05-18,lil baby southside,spotify:track:5lf3ajySox32qFvGEf2TFM
,142273.0,True,,"Lil Baby, Drake",,Yes Indeed,8,,2018-05-18,lil baby yes indeed,spotify:track:6vN77lE9LK6HP2DewaN6HZ
,216631.0,True,,"Lil Dicky, Chris Brown",,Freaky Friday (feat. Chris Brown),16,,2018-03-15,lil dicky freaky friday,spotify:track:10Igtw8bSDyyFs7KIsKngZ
,214426.0,True,,"Lil Peep, Lil Tracy",,Awful Things,1,,2017-08-15,lil peep awful things,spotify:track:7Hr2XoaGpIMKbNXCZDZ3le
,181714.0,True,,Lil Pump,,Esskeetit,12,,2018-04-13,lil pump esskeetit,spotify:track:44KKhCyI0BGS6LvVyDqJtH
,124055.0,True,,Lil Pump,,Gucci Gang,23,,2017-10-06,lil pump gucci gang,spotify:track:43ZyHQITOjhciSUUNPVRHc
,211200.0,True,,"Lil Skies, Yung Pinch",,I Know You (feat. Yung Pinch),3,,2018-05-31,lil skies i know you,spotify:track:5Cg98kiDYtCEHmjcKD0CJD
,156000.0,True,,Lil Skies,,Lust,4,,2017-12-12,lil skies lust,spotify:track:7oJrVhiTPZGBXWPwhxjy9S
,203907.0,True,,"Lil Skies, Landon Cube",,Nowadays (feat. Landon Cube),13,,2017-12-20,lil skies nowadays,spotify:track:689uBlyIufk2LUhAwjny4w
,262544.0,True,,"Lil Skies, Landon Cube",,Red Roses (feat. Landon Cube),20,,2017-12-12,lil skies red roses,spotify:track:3ZhTT6yjZwpPph5MIJ53XY
,247347.0,True,,Lil Uzi Vert,,444+222,3,,2017-08-25,lil uzi vert 444+222,spotify:track:1QgTBfRN5m81a5K01qens6
,173419.0,True,,Lil Uzi Vert,,Dark Queen,2,,2017-08-25,lil uzi vert dark queen,spotify:track:2ZdCrBA52bb4pIG3tOOZiQ
,177048.0,True,,Lil Uzi Vert,,For Real,1,,2017-08-25,lil uzi vert for real,spotify:track:3tcoEYOZUHKB3RKNByIN13
,258789.0,True,,"Lil Uzi Vert, Pharrell Williams",,Neon Guts (feat. Pharrell Williams),2,,2017-08-25,lil uzi vert neon guts,spotify:track:1MJErNPIQUoEMu4YUUmecm
,189229.0,True,,Lil Uzi Vert,,No Sleep Leak,1,,2017-08-25,lil uzi vert no sleep leak,spotify:track:0QV16pno66L6K3fn4W13b7
,207038.0,True,,Lil Uzi Vert,,Sauce It Up,15,,2017-08-25,lil uzi vert sauce it up,spotify:track:1uL78kFWxhz3umTMWJu8n5
,221746.0,True,,"Lil Uzi Vert, Oh Wonder",,The Way Life Goes (feat. Oh Wonder),22,,2017-08-25,lil uzi vert the way life goes,spotify:track:2eAZfqOm4EnOF9VvN50Tyc
,182706.0,True,,Lil Uzi Vert,,XO TOUR Llif3,1,,2017-08-25,lil uzi vert two,spotify:track:7GX5flRQZVHRAGd6B4TmDO
,190355.0,True,,"Lil Uzi Vert, The Weeknd",,UnFazed (feat. The Weeknd),1,,2017-08-25,lil uzi vert unfazed,spotify:track:5O8x1YlmLQopQHErxtDfi9
,173797.0,True,,Lil Uzi Vert,,X,2,,2017-08-25,lil uzi vert x,spotify:track:5tRmoZRoupvMYPV1oezFrH
,182706.0,True,,Lil Uzi Vert,,XO TOUR Llif3,34,,2017-08-25,lil uzi vert xo tour llif3,spotify:track:7GX5flRQZVHRAGd6B4TmDO
,187173.0,True,,Lil Xan,,Betrayed,19,,2018-04-06,lil xan betrayed,spotify:track:4vaxvNDaLSoD36iZX515ug
,153474.0,True,,"Lil Yachty, Trippie Redd",,66,1,,2018-03-09,lil yachty 66,spotify:track:6tarvNiKnEjYMj1VZhlDqR
,229525.0,True,,"Lil Yachty, Ugly God",,BOOM!,1,,2018-03-09,lil yachty boom!,spotify:track:2PsZsnqSMXt4oKi0xHVvgF
,139845.0,True,,"Lil Yachty, YoungBoy Never Broke Again",,NBAYOUNGBOAT,4,,2018-03-09,lil yachty nbayoungboat,spotify:track:6K2anECyrckidwf5wxS78Q
,247612.0,True,,"Lil Yachty, Migos",,Peek A Boo,4,,2017-04-13,lil yachty peek a boo,spotify:track:1iTWoKAdilGEmit6xhQZje
,200457.0,False,,"Lin-Manuel Miranda, Alex Lacamoire, Ana Villafañe, Anthony Ramos, Camila Cabello, Dessa, Ednita Nazario, Fat Joe, Gilberto Santa Rosa, Gina Rodriguez, Gloria Estefan, Jennifer Lopez, Joell Ortiz, John Leguizamo, Juan Luis Guerra 4.40, Luis Fonsi, Marc Anthony, Pj Sin Suela, Pedro Capó, Rita Moreno, Rubén Blades, Tommy Torres",,Almost Like Praying (feat. Artists for Puerto Rico),1,,2017-10-06,lin-manuel miranda almost like praying,spotify:track:3dskm5fAe8OkBtM9E0VVWx
,179242.0,False,,"Ben Platt, Lin-Manuel Miranda",,Found/Tonight,1,,2018-03-19,lin-manuel miranda found / tonight,spotify:track:0ileL1L3Vtpf5VZ5RQZ94m
,169800.0,True,,"Linkin Park, Kiiara",,Heavy (feat. Kiiara),19,,2017-05-19,linkin park heavy,spotify:track:104buTcnP2AsxqB7U1FIZ4
,216933.0,False,,Linkin Park,,In The End,1,,2000-10-24,linkin park in the end,spotify:track:60a0Rd6pjrkxjPbaKzXjfq
,185586.0,False,,Linkin Park,,Numb,1,,2003-03-24,linkin park numb,spotify:track:2nLtzopw4rPReszdYBJU6h
,260933.0,False,,Little Big Town,,Better Man,7,,2016-10-20,little big town better man,spotify:track:0jMikeoKkkSOby4ofddqYs
,250173.0,True,,"Logic, Alessia Cara, Khalid",,1-800-273-8255,41,,2017-05-05,logic 1-800-273-8255,spotify:track:5tz69p7tJuGPeMGwNTxYuV
,188600.0,True,,Logic,,44 More,5,,2018-03-09,logic 44 more,spotify:track:3e7Y6sfFlIdBMJhX7wpqVO
,331266.0,True,,"Logic, Damian Lemar Hudson",,Black SpiderMan,1,,2017-05-05,logic black spiderman,spotify:track:7BKUWh5sdtdS17crohRe4L
,221360.0,True,,Logic,,BoomTrap Protocol,1,,2018-03-09,logic boomtrap protocol,spotify:track:4fZxGiES1FKbNqJPrI4L3s
,217146.0,True,,Logic,,Contra,1,,2018-03-09,logic contra,spotify:track:7u90MSvVyEjL0c8icaE7jl
,250173.0,True,,"Logic, Alessia Cara, Khalid",,1-800-273-8255,2,,2017-05-05,logic everybody,spotify:track:5tz69p7tJuGPeMGwNTxYuV
,204746.0,True,,"Logic, Marshmello",,Everyday,13,,2018-03-09,logic everyday,spotify:track:4EAV2cKiqKP5UPZmY6dejk
,260320.0,True,,"Logic, Wiz Khalifa",,Indica Badu,1,,2018-03-09,logic indica badu,spotify:track:0jqBo5RYn008f4ZY8kPewW
,241426.0,True,,Logic,,Midnight,1,,2018-03-09,logic midnight,spotify:track:1GtVGc1UYin3zpMUdNSSpM
,217560.0,True,,Logic,,Overnight,1,,2018-03-09,logic overnight,spotify:track:3s3VVLE1kB7Xk2AoJKlGmr
,240093.0,True,,"Logic, Young Sinatra",,Warm It Up,1,,2018-03-09,logic warm it up,spotify:track:3W4JFzOQdo5J2Wgt9DFg24
,219480.0,True,,"Logic, Big Sean",,Wassup,1,,2018-03-09,logic wassup,spotify:track:5KVciTEfXvpcFHR3RFbtJy
,173693.0,True,,Logic,,Yuck,1,,2018-03-09,logic yuck,spotify:track:0D5CXSUx8GOCHSY8KWgi9h
,208226.0,False,,Lord Huron,,The Night We Met,4,,2015-04-07,lord huron the night we met,spotify:track:0QZ5yyl6B6utIWkxeBDxQN
,234652.0,False,,Lorde,,Green Light,9,,2017-06-16,lorde green light,spotify:track:6ie2Bw3xLj2JcGowOlcMhb
,214254.0,True,,"Lorde, Khalid, Post Malone, SZA",,Homemade Dynamite - REMIX,1,,2017-11-10,lorde homemade dynamite,spotify:track:5u64RlrnvvbtNh6R0EMh6o
,171727.0,False,,Lorde,,Liability,1,,2017-06-16,lorde liability,spotify:track:6Kkt27YmFyIFrcX3QXFi2o
,207786.0,False,,Loren Allred,,Never Enough,4,,2017-12-08,loren allred never enough,spotify:track:0Gl5s8IhMmQE5YQwM8Qx1J
,190427.0,True,,"Louis Tomlinson, Bebe Rexha, Digital Farm Animals",,Back to You (feat. Bebe Rexha & Digital Farm Animals),10,,2017-07-21,louis tomlinson back to you,spotify:track:7F9vK8hNFMml4GtHsaXui6
,228826.0,False,,"Luis Fonsi, Daddy Yankee, Justin Bieber",,Despacito - Remix,49,,2017-04-17,luis fonsi despacito,spotify:track:6rPO02ozF3bM7NnOV4h6s2
,173720.0,False,,"Luis Fonsi, Demi Lovato",,Échame La Culpa,19,,2017-11-17,luis fonsi echame la culpa,spotify:track:2hl6q70unbviGo3g1R7uFx
,206213.0,False,,Luke Bryan,,Fast,12,,2015-08-07,luke bryan fast,spotify:track:2gYiCTytrSRtuaHP1Nac6u
,177305.0,False,,Luke Bryan,,Light It Up,18,,2017-12-08,luke bryan light it up,spotify:track:5w3NgfV8v1nNZFLUBlGHIL
,221800.0,False,,Luke Bryan,,Most People Are Good,18,,2017-12-08,luke bryan most people are good,spotify:track:79LAFAkR1ATb4iIQvZuCL0
,216093.0,False,,Luke Bryan,,"Sunrise, Sunburn, Sunset",1,,2017-12-08,"luke bryan sunrise, sunburn, sunset",spotify:track:53yTYusPQJ1AApL1hi0Dnc
,193200.0,False,,Luke Combs,,Beautiful Crazy,4,,2018-06-01,luke combs beautiful crazy,spotify:track:2rxQMGVafnNaRaXlRMWPde
,222533.0,False,,Luke Combs,,Hurricane,22,,2017-06-02,luke combs hurricane,spotify:track:6xHI9KjUjYT0FPtGO8Mxa1
,198880.0,False,,Luke Combs,,Must've Never Met You,1,,2018-06-01,luke combs must've never met you,spotify:track:6ojicjDYUUoeE1tdSvfFo4
,221800.0,False,,Luke Combs,,One Number Away,16,,2017-06-02,luke combs one number away,spotify:track:4gB7HrYHbJVJ5RFOjxmoq4
,240760.0,False,,Luke Combs,,When It Rains It Pours,20,,2017-06-02,luke combs when it rains it pours,spotify:track:1mMLMZYXkMueg65jRRWG1l
,223846.0,False,,MAX,,Lights Down Low,27,,2016-04-08,max lights down low,spotify:track:5A6BJLZArq1MPjsnmcuk5f
,199973.0,False,,"Machine Gun Kelly, Hailee Steinfeld",,At My Best (feat. Hailee Steinfeld),8,,2017-05-12,machine gun kelly at my best,spotify:track:77lGafvlU68CeHgB2pkHC9
,243597.0,False,,Jason Gordon,,Bad Things - (Machine Gun Kelly x Camila Cabello x Cover Version),10,,2017-01-25,machine gun kelly x camila cabello bad things,spotify:track:3XjqLgDutxuGWZlZU1yisE
,202804.0,False,,"Machine Gun Kelly, X Ambassadors, Bebe Rexha",,"Home (with Machine Gun Kelly, X Ambassadors & Bebe Rexha)",4,,2017-11-18,"machine gun kelly, x ambassadors home",spotify:track:0OI7AFifLSoGzpb8bdBLLV
,220454.0,True,,"Macklemore, Skylar Grey",,Glorious (feat. Skylar Grey),19,,2017-09-22,macklemore glorious,spotify:track:0CokSRCu5hZgPxcZBaEzVE
,240506.0,False,,"Macklemore, Kesha",,Good Old Days (feat. Kesha),19,,2017-09-22,macklemore good old days,spotify:track:2Za1AlJNvksouPPWbXpR2X
,225849.0,False,,"Major Lazer, Travis Scott, Camila Cabello, Quavo",,Know No Better,3,,2017-06-01,major lazer know no better,spotify:track:6BKeNWeUqxmvQ09Gxd3ZGX
,203180.0,True,,"Major Lazer, PARTYNEXTDOOR, Nicki Minaj",,Run Up,1,,2017-01-26,major lazer run up,spotify:track:0SujigeT7cxuxBfhN3eOcp
,230000.0,False,,Maluma,,Felices los 4,20,,2018-05-18,maluma felices los 4,spotify:track:1RouRzlg8OKFeqc6LvdxmB
,211767.0,False,,Maren Morris,,80s Mercedes,2,,2017-03-17,maren morris 80s mercedes,spotify:track:58spuRyMUsjKHQHEGwLC99
,220387.0,False,,"Maren Morris, Vince Gill",,Dear Hate,1,,2017-10-03,maren morris dear hate,spotify:track:7zOoHxDt1duHL8czY7o7ab
,196421.0,False,,Maren Morris,,I Could Use a Love Song,20,,2017-03-17,maren morris i could use a love song,spotify:track:09iyGiljLWRYXdRazFkdtJ
,241106.0,False,,Mariah Carey,,All I Want for Christmas Is You,4,,1994,mariah carey all i want for christmas is you,spotify:track:0bYg9bo50gSsH3LtXe2SQn
,288826.0,False,,Mariah Carey,,I Don't Wanna Cry,1,,1990-06-12,mariah carey i don't,spotify:track:1hFtJ5rV3aAm58ErijHdFO
,197773.0,False,,Marian Hill,,Down,15,,2016-06-24,marian hill down,spotify:track:5eCkuGPZNl4mISFNPgr3Dd
,234308.0,True,,"Maroon 5, Future",,Cold (feat. Future),20,,2018-06-15,maroon 5 cold,spotify:track:7gwLQ4tZ5UdZ7qNcDyJ8wr
,214265.0,False,,"Maroon 5, Kendrick Lamar",,Don't Wanna Know (feat. Kendrick Lamar),11,,2018-06-15,maroon 5 don't wanna know,spotify:track:1nueTG77MzNkJTKQ0ZdGzT
,235545.0,True,,"Maroon 5, Cardi B",,Girls Like You (feat. Cardi B),6,,2018-05-30,maroon 5 girls like you,spotify:track:6FRLCMO5TUHTexlWo8ym1W
,190642.0,False,,Maroon 5,,Wait,24,,2018-06-15,maroon 5 wait,spotify:track:6AvfZXpbb6r35DfF7gHPRq
,199849.0,False,,"Maroon 5, SZA",,What Lovers Do (feat. SZA),21,,2018-06-15,maroon 5 what lovers do,spotify:track:2j5hsQvApottzvTn4pFJWF
,273802.0,False,,Marshmello,,Alone,1,,2016-05-13,marshmello alone,spotify:track:12mGwph2YzDIlChtq3EdXP
,202620.0,True,,"Marshmello, Anne-Marie",,FRIENDS,21,,2018-02-09,marshmello friends,spotify:track:08bNPGLD8AhKpnnERrAc6G
,180822.0,False,,"Marshmello, Khalid",,Silence,22,,2017-08-11,marshmello silence,spotify:track:7vGuf3Y35N4wmASOKLUVVU
,216419.0,False,,"Martin Garrix, Khalid",,Ocean (feat. Khalid),1,,2018-06-15,martin garrix ocean,spotify:track:3nc420PXjTdBV5TN0gCFkS
,220883.0,False,,"Martin Garrix, Dua Lipa",,Scared to Be Lonely,14,,2017-01-27,martin garrix scared to be lonely,spotify:track:3ebXMykcMXOcLeJ9xZ17XH
,192520.0,False,,Mason Ramsey,,Famous,2,,2018-07-20,mason ramsey famous,spotify:track:1lasE4yXQmZ5mwWdGQGn8E
,282666.0,True,,Meek Mill,,1942 Flows,1,,2017-07-21,meek mill 1942 flows,spotify:track:7sLDnUauivS2vN6Z9EfUJT
,257853.0,False,,"Meek Mill, Lil Uzi Vert",,F**k That Check Up (feat. Lil Uzi Vert),1,,2017-07-21,meek mill f**k that check up,spotify:track:7KmguHS8eVmZOpdpg0gnv2
,250466.0,True,,Meek Mill,,Heavy Heart,1,,2017-08-04,meek mill heavy heart,spotify:track:1QiwdLAzAnzmiwvoGMXM7b
,211684.0,True,,Meek Mill,,Issues,1,,2017-07-21,meek mill issues,spotify:track:1GOuHB20lqVyxv3GdxovPY
,227956.0,True,,"Meek Mill, Young Thug",,We Ball (feat. Young Thug),1,,2017-08-04,meek mill we ball,spotify:track:4iDtAYDLJWM2TrTERKPvFq
,205373.0,True,,"Meek Mill, Chris Brown, Ty Dolla $ign",,Whatever You Need (feat. Chris Brown & Ty Dolla $ign),13,,2017-07-21,meek mill whatever you need,spotify:track:6yMxfx9wpiuhhdb8vHDVMu
,205373.0,True,,"Meek Mill, Chris Brown, Ty Dolla $ign",,Whatever You Need (feat. Chris Brown & Ty Dolla $ign),1,,2017-07-21,meek mill wins & losses,spotify:track:6yMxfx9wpiuhhdb8vHDVMu
,152862.0,False,,Meghan Trainor,,NO EXCUSES,12,,2018-03-01,meghan trainor no excuses,spotify:track:7fCNUWi6uflDTQ08srxMZk
,261733.0,True,,"Metro Boomin, Offset, Drake",,No Complaints,5,,2017-06-23,metro boomin no complaints,spotify:track:6kig1UFggPUyZBCvXD3Wod
,176986.0,False,,Michael Ray,,Think A Little Less,11,,2015-08-07,michael ray think a little less,spotify:track:4JjIIBNoho0V2gZjH4nEzR
,220800.0,False,,Midland,,Drinkin' Problem,20,,2017-09-22,midland drinkin' problem,spotify:track:1vBpwxsLVwaR4evBIaFmqD
,287992.0,True,,Migos,,Auto Pilot,1,,2018-01-26,migos auto pilot,spotify:track:4Kw3CztmD15X1QGDnnHmLD
,251858.0,True,,"Migos, 21 Savage",,BBO (Bad Bitches Only),2,,2018-01-26,migos bbo (bad bitches only),spotify:track:4BHzHISX21PYwGXiBEUQ70
,343150.0,True,,"Migos, Lil Uzi Vert",,Bad and Boujee (feat. Lil Uzi Vert),25,,2017-01-27,migos bad and boujee,spotify:track:4Km5HrUvYTaSUfiSGPJeQR
,259340.0,True,,"Migos, Gucci Mane",,CC,1,,2018-01-26,migos cc,spotify:track:35ffVv9x4mtzBh5rF1K9sP
,232705.0,True,,Migos,,Call Casting,1,,2017-01-27,migos call casting,spotify:track:0jOfl1nZf6sVBTG08Q4brn
,276147.0,True,,"Migos, Drake",,Walk It Talk It,1,,2018-01-26,migos culture,spotify:track:6n4U3TlzUGhdSFbUUhTvLP
,214586.0,True,,"Migos, Marshmello",,Danger (with Migos & Marshmello),1,,2017-12-08,migos danger,spotify:track:0nhVrTiCGiGRCoZOJiWzm1
,315185.0,True,,Migos,,Emoji A Chain,1,,2018-01-26,migos emoji a chain,spotify:track:0G9rmRmQDFk9O2tzZLyRkc
,181318.0,True,,Migos,,Gang Gang,1,,2018-01-26,migos gang gang,spotify:track:6RKkHI2fkmgZq7uQPPav8f
,257545.0,True,,Migos,,Get Right Witcha,1,,2017-01-27,migos get right witcha,spotify:track:76Y0gxtTxN0FyDCYh5qYQj
,255849.0,True,,Migos,,Higher We Go - Intro,1,,2018-01-26,migos higher we go (intro),spotify:track:43dOwOq0mB4i6j4SpcSkqC
,363934.0,True,,"Migos, Travis Scott",,Kelly Price (feat. Travis Scott),2,,2017-01-27,migos kelly price,spotify:track:204U3zjm9kkzX25Pr4Rdld
,255378.0,True,,Migos,,Narcos,9,,2018-01-26,migos narcos,spotify:track:0wbnC9AUenxp613TYaJsGK
,233880.0,True,,"Migos, Post Malone",,Notice Me,5,,2018-01-26,migos notice me,spotify:track:3OnOomd79OjqSYHchCQ6ht
,304041.0,True,,"Migos, Gucci Mane",,Slippery (feat. Gucci Mane),21,,2017-01-27,migos slippery,spotify:track:6p8NuHm8uCGnn2Dtbtf7zE
,190288.0,True,,Migos,,Stir Fry,20,,2018-01-26,migos stir fry,spotify:track:2UVbBKQOdFAekPTRsnkzcf
,293137.0,True,,Migos,,Supastars,1,,2018-01-26,migos supastars,spotify:track:7yt6eiZQCkVFEzwGp4Pbor
,242407.0,True,,Migos,,T-Shirt,23,,2017-01-27,migos t-shirt,spotify:track:7KOlJ92bu51cltsD9KU5I7
,276147.0,True,,"Migos, Drake",,Walk It Talk It,22,,2018-01-26,migos walk it talk it,spotify:track:6n4U3TlzUGhdSFbUUhTvLP
,202834.0,True,,"Migos, Travis Scott, Ty Dolla $ign, Big Sean",,White Sand,1,,2018-01-26,migos white sand,spotify:track:2KokOIKdw4zZutDil85Ugh
,303076.0,True,,"Migos, Nicki Minaj, Cardi B",,MotorSport,21,,2018-01-26,"migos, nicki minaj motorsport",spotify:track:4wFjTWCunQFKtukqrNijEt
,259333.0,True,,"Miguel, Travis Scott",,Sky Walker (feat. Travis Scott),25,,2017-12-01,miguel sky walker,spotify:track:5WoaF1B5XIEnWfmb5NZikf
,231906.0,False,,Miley Cyrus,,Malibu,15,,2017-09-29,miley cyrus malibu,spotify:track:1UZOjK1BwmwWU14Erba9CZ
,231906.0,False,,Miley Cyrus,,Malibu,1,,2017-09-29,miley cyrus younger now,spotify:track:1UZOjK1BwmwWU14Erba9CZ
,259279.0,False,,Miranda Lambert,,Tin Man,1,,2016-11-18,miranda lambert tin man,spotify:track:4ckQIgBy1gVeevf7UAereE
,213120.0,True,,"Missy Elliott, Lamb",,I'm Better (feat. Lamb),1,,2017-01-27,missy elliott i'm better,spotify:track:2Kf9fwIOwZwd6Aw7OxfkF0
,213183.0,False,,Morgan Evans,,Kiss Somebody,1,,2018-10-12,morgan evans kiss somebody,spotify:track:4f3fb3alVLFc8Ga4ncpg7x
,198120.0,False,,"Morgan Wallen, Florida Georgia Line",,Up Down (feat. Florida Georgia Line),15,,2018-04-27,morgan wallen up down,spotify:track:3EWMoDIm6lzuR0zQKtuCJX
,219706.0,True,,"N.E.R.D, Rihanna, Pharrell Williams",,Lemon,21,,2017-12-15,n*e*r*d lemon,spotify:track:4PpuH4mxL0rD35mOWaLoKS
,195053.0,True,,"NAV, Travis Scott",,Champion (feat. Travis Scott),1,,2018-05-18,nav champion,spotify:track:6nO3tr47nr2P7f3hXb8JIo
,228080.0,True,,"NAV, Lil Uzi Vert",,Wanted You (feat. Lil Uzi Vert),7,,2017-11-03,nav wanted you,spotify:track:790MhTXPFrYkrqCKvpg4t1
,212120.0,False,,NF,,Let You Down,27,,2017-10-06,nf let you down,spotify:track:52okn5MNA47tk87PeZJLEL
,183826.0,False,,NF,,NO NAME,1,,2018-01-19,nf no name,spotify:track:7hdw5gAGMyyn9z0XgfTv1j
,192160.0,False,,Nat King Cole,,The Christmas Song (Merry Christmas To You),3,,1962,nat king cole the christmas song (merry christmas to you),spotify:track:4PS1e8f2LvuTFgUs1Cn3ON
